calisma_sekli,departman,egitim,genel_nit_is_tanimi,ilan_baslik,label,sehir,sektor,sirket_adi,tecrube
Uzman,Sürekli / Tam zamanlı,,"Danışmanlığını yaptığımız, uzun yıllardır Ankara' da faaliyet gösteren ve sektörün liderlerinden olan firmada görevlendirilmek üzere aşağıdaki yetkinliklere sahip ,Şirket Avukatı, aranmaktadır.,Genel Nitelikler:,Üniversitelerin Hukuk Fakültesinden mezun, ,Avukatlık stajından sonra büyük ölçekli firmalarda Şirket Avukatı olarak min. 5 yıl çalışmış,,Araştırmacı, sorumluluk duygusu yüksek, takip ve sonuçlandırma konusunda yetkin,,İletişim ve ikna yeteneği güçlü,,Kurumsal temsil yönü kuvvetli, inisiyatif alabilen, ,MS Office programlarını iyi derecede kullanabilen,,Analitik, verileri yorumlayabilen, hızlı sonuca gidebilen, dikkatli, sunum yapabilen ve değişime açık,,Ankara’ da ikamet eden, ,Askerlik hizmetini tamamlamış, ,Sürücü belgesine sahip ve aktif araç kullanabilen.     ,İş Tanımı:, ,Şirketin Türk Ticaret Kanunu, Borçlar Kanunu ve İş Kanunu gibi ana hukuk konularında bilgi sahibi olmak, yönlendirmeler yapmak ve hukuki süreçleri yönetmek,,Mevzuat, Yargıtay ve Yüksek Mahkeme kararlarını düzenli olarak takip etmek,,Şirketin tam zamanlı hukuki danışmanlığını yapmak,,Şirket ile ilgili doğabilecek her türlü hukuki durumlarla ilgili gerekli müdahalede bulunmak,,Genel Kurul, İmza Sirküleri ve İç yönerge gibi TTK kapsamındaki işleri takip etmek,,Yönetim Kurulu kararlarını hazırlamak,,Tüm şirket sözleşmelerini gözden geçirmek ve/veya hazırlanmak, gerektiğinde hukuki süreci takip etmek,,Tüm birimlere hukuki süreçlerde destek vermek ve koordineli çalışmak,,Tüm dava- duruşma ve icra takip süreçlerinde şirketi temsil etmek ve şirket lehine aksiyonlar almak.",Şirket Avukatı ,hukuk_avukat,,Avukatlık ve Hukuki Danışmanlık ,Sektöründe Lider Firma,En az 5 yıl tecrübeli adaylar
,,,"GENEL NİTELİKLER VE İŞ TANIMI,KASTAMONU'DA BULUNAN AVUKATLIK BÜROMUZDA GÖREVLENDİRİLMEK ÜZERE;,Ofis içerisinde telefonla arama yaparak ya da gelen çağrıları yanıtlayarak takibini yürüttüğümüz;,İcra takip dosyalarına tahsilat sağlayacak,,Sözlü iletişim becerisi güçlü,çalışkan ya da bu konuda kendini geliştirecek,,Adalet Meslek Yüksek Okulu mezunu ,Kastamonu Merkez'de ikamet eden,Hukuk sekreterleri aramaktayız.",Adalet Yüksekokulu Mezunu Hukuk Sekreteri,hukuk_avukat,,,Tuncay Yılmaz Avukatlık Bürosu,
,,,"GLO, hukuk hizmetleri sektöründe yerli ve yabancı müvekkillerine 35 yıldır hukuki hizmetler vermektedir. Profesyonellik ve kalite prensiplerine dayalı iş anlayışı ve titiz çalışmalarıyla müvekkillerini memnun etmeyi amaçlayan bir ofistir.,Faaliyetlerini geliştirmek, etkinleştirmek, ileri hedeflerine ulaşmak üzere GLO’ya katkı sağlayacak ve ortaklık sistemine uyum sağlayabilecek İş Arkadaşları aranmaktadır.,Avukatlık ruhsatına sahip olmak (MBA yapmış olmak ve arabuluculuk yetkisine sahip olmak tercih sebebidir.),,Dava avukatlığı ve duruşma tecrübesi olmak,,Staj hariç en az ,5 yı,l tecrübeli olmak,Çok iyi derecede İngilizce bilmek ( Almanca, İspanyolca ya da başka bir ikinci dil tercih sebebidir.),Müvekkil odaklı çalışabilmek,,Girişimci bir ruha sahip olmak,,Ekip üyesi olabilmek,,İletişim becerisi yüksek; güler yüzlü olmak,,Analitik düşünebilmek, öğrenme odaklı olmak,,Kendisini yazarak iyi ifade edebilmek,,Seyahat edebilmek,,Sıkı ve gerekirse esnek çalışabilmek,,Ofis programlarını iyi kullanabilmek ve benzer programları öğrenebilmek,,Erkek adaylar için askerlik hizmetini tamamlamış olmak.",Avukat,hukuk_avukat,,,Göğüş Hukuk Bürosu Münevver Lale BAUER,
,,,"Üniversitelerin Hukuk fakültelerinden mezun,,Avukatlık ruhsatını almış,,Alanında en az 3 yıl deneyim sahibi,,Özellikle Sözleşme hazırlanması ve, Şirket Danışmanlığı konusunda deneyim sahibi,,Ticaret Hukuku, Borçlar Hukuku, İş Hukuku, TTK ve Tüketici mevzuatına hakim,,Dava ve icra takibi deneyimi olan,,Titiz ve dikkatli çalışan,,Uyap sistemine hakim,,MS Office programlarını etkin kullanabilen,,Çok iyi derecede yazma ve konuşma konusunda İngilizce dil bilgisine sahip,, ,‘AVUKAT' pozisyonunda faaliyet gösterecek prezentabl takım arkadaşı arıyoruz.",Avukat,hukuk_avukat,,,Odaman & Taşkın Litigation Boutique,
4,Sürekli / Tam zamanlı,,"İnşaat, Enerji, Turizm, Medya ve Madencilik sektörlerinde faaliyet gösteren firmamızın Ankara Merkez Ofisinde görevlendirilmek üzere;,Üniversitelerin hukuk fakültelerinden mezun,,Kurumsal firmaların hukuk departmanlarında görev almış,,Avukatlık stajını tamamladıktan sonra en az 4 yıl tecrübe edinmiş,,Duruşma tecrübesi olan,,Tercihen İleri düzeyde İngilizce ve mesleki İngilizce bilen,,Tam zamanlı görev alabilecek,,Özellikle iş hukuku, ticaret hukuku ve sözleşmeler konusunda tecrübeli,,Şirketlerin hukuk departmanlarında kariyer hedefleyen,,Sistematik, düzenli ve takım çalışmasına yatkın,,Ankara'da ikamet eden/edebilecek,,Erkek adaylar için askerlik görevini tamamlamış,,""Şirket Avukatı"" arayışımız bulunmaktadır.",Avukat,hukuk_avukat,,Hukuk,Gizli Firma,
Sürekli / Tam zamanlı,Hukuk,"Üniversite(Mezun), Yüksek Lisans(Mezun)","Bachelor’s degree in Law (LLM degree obtained from US/UK will be an asset),,Minimum of 3 years of experience  in the fields of Corporate, Real Estate and Contracts Law in a law firm or corporate legal department,,Negotiation, reviewing and drafting skills a wide variety of contracts in both English and Turkish,,Excellent communication skills, both verbally and in writing.",Avukat,hukuk_avukat,İstanbul(Avr.)(Şişli),Yönetim Danışmanlığı ,MGC Danışmanlık A.Ş.,3 - 6 yıl tecrübeli adaylar
,,,"Üniversitelerin Hukuk bölümünden mezun,,En az 6 yıl tecrübesi olan,,Özellikle  İş Hukuku, Ticaret Hukuku, Borçlar Hukuku, İcra İflas Hukuku, Medeni Hukuk ve Deniz Hukuku konularında tecrübeli ve bu ,konularda dava takip deneyimi olan,,İcra dosyası takip deneyimi olan,,Ekip çalışmasına uyumlu, iletişimi kuvvetli ve sonuç odaklı,,İş disiplini yüksek, proaktif ve zaman yönetiminde başarılı, ,Seyahat engeli olmayan ve şehir dışı duruşmalara katılabilecek,,Tercihen İngilizce bilen.,İŞ TANIMI ,Şirketin taraf olduğu dava ve icra dosyalarının takibi, ,Takip edilen dosyaların düzenlenmesi ve Şirket Yönetimine aylık olarak raporlama yapılması,,Sözleşmeli avukatlarla koordinasyonun yürütülmesini sağlamak,,Şirketteki birimlere hukuki riskler konusunda destek verilmesi ve görüş bildirilmesi, ,Şirketin idari mercilerle olan yazışmalarının yürütülmesi,,Mevzuat takibi ve uyum çalışmalarının yapılması.",Avukat,hukuk_avukat,,,Med Marine Kılavuzluk ve Römorkör Hizm. İnş. San.Tic.A.Ş,
,,Üniversite(Mezun),"Farklı sektörlerde faaliyet gösteren firmamızın Bursa ilindeki tesisinde görevlendirilmek üzere; ,Üniversitelerin hukuk fakültelerinden mezun, ,Kurumsal firmaların hukuk departmanlarında görev almış,,Avukatlık stajını tamamladıktan sonra en az 5 yıl tecrübe edinmiş,,Duruşma tecrübesi olan, ,Tercihen İleri düzeyde İngilizce ve mesleki İngilizce bilen, ,Tam zamanlı görev alabilecek, ,Özellikle iş hukuku konusunda tecrübeli,,Sistematik, düzenli ve takım çalışmasına yatkın, ,Erkek adaylar için askerlik görevini tamamlamış, ,""Şirket Avukatı"", arayışımız bulunmaktadır.",Avukat(Bursa),hukuk_avukat,,,Gizli Firma,En az 5 yıl tecrübeli adaylar
,,,"Lojistik sektöründe 60 yıldır faaliyet gösteren ve sektörün öncü kuruluşlarından olan şirketimizin; genel merkezinde görevlendirilmek üzere ,‘’Avukat’’, arayışımız bulunmaktadır. ,Üniversitelerin Hukuk Fakültelerinden mezun,,En az 1 yıl ,en fazla 5 yıl tecrübesi olan,,Şirketler Hukuku ve İş Hukuku'na hakim,,Arabuluculuk görüşmeleri konusunda tecrübeli,,İletişim becerileri kuvvetli,,Analitik düşünce yapısına sahip, çözüm odaklı, hızlı ve detaya önem veren,,İş takibi, raporlama, takım çalışması ve zaman yönetimi konularında yetkin,,MS Office programlarını, UYAP'a bağlı programlara hakim ve başkaca hukuk yazılımlarını kullanmış,,Yoğun iş temposuna uyum sağlayabilen,,Seyahat engeli olmayan,,Tam zamanlı,,İŞ TANIMI,Şirketin ihtiyaç duyduğu her türlü hukuki iş ve işlemlerin takibi, sonuçlandırılması ve hukuka uygunluğun denetlenmesi,,Gerektiğinde her türlü ihtarname, beyan, ihbarnameler vb. hukuken bağlayıcı belgelerin hazırlanması, müzakere işlemlerinin yürütülmesi ve bağlı dava ve takipli işlerin yürütülmesi,,Resmi ve idari makamlarca ve iş yapılan üçüncü kişilerce şirkete gönderilen ve hukuk departmanını ilgilendiren taleplere cevap yazısı hazırlanması ve yönetici onayına sunulması,,Sözleşmelerin sistem üzerine kaydedilmesi, takibi, yönetimi, risklerin tespiti, yenilenmesi gerektiğinde güncellenmesi,,Sözleşmelerin arşivlenmesi, tasfiyesi ve sonlandırılması ile ilgili süreçlerin takip edilmesi,,Hukuk departmanına ait raporlamaların düzenli olarak hazırlanması,,Niteliklerine sahip adayların başvurularını beklemekteyiz.",AVUKAT,hukuk_avukat,,,Murat Lojistik Ekspres Taş. Tic. ve San. Ltd. Şti.,
,,,"NAZALI, kamu ve özel sektör tecrübesine de sahip ortak ve çalışanları ile hukuk, vergi, sosyal güvenlik, gümrük alanlarında uzmanlaşmıştır. Dinamik, alanında uzman ve tecrübeli ekibiyle, kısa sürede birçok yerel ve uluslararası firma ile çalışan NAZALI' nın temel üstünlüğü, hukuk ile birlikte mali ve teknik konuların olası tüm boyutlarını bir arada değerlendirerek müşteri ve müvekkillerine tek çatı altında kapsamlı hizmet sunabilmesidir.,NAZALI’ da hukuk ile birlikte ilgili hukukun ilgili alanını ilgilendiren teknik ve mali birimler bir arada çalışarak en uygun çözümü müvekkillere sunabilmektedir. Bu kapsamda hukuk danışmanlığına yönelik konularda avukatlarımız vergi, finans, gümrük ve teknik uzmanlar ile çalışmaktadır.  ,Şirketler Hukuku departmanımızda görevlendirilmek üzere ,“Avukat/Kıdemli Avukat”, pozisyonunda arayışımız bulunmaktadır., ,GENEL NİTELİKLER,Üniversitelerin, Hukuk fakültelerinden mezun olmuş,,İleri seviyede İngilizce dil bilgisine sahip,,Kişisel Verilerin Korunması Kanunu yürürlüğe girdiği tarih olan 2016 yılından bu yana yoğun bir şekilde projeler yürütmüş,,Aylık danışmanlık ve sair KVK süreçlerine yönelik süreçlerde aktif şekilde yer almış,,Projelerin her aşamasında aktif bir şekilde görev almış,,Alanında ,en az 5 yıl, tecrübesi bulunan,,Tercihen, Şirketler Hukuku, Ticaret Hukuku, Bilişim ve Teknoloji Hukuku alanında çalışmalar yürütmüş,,Ekip çalışmasına yatkın,,Yoğun çalışma ortamına uyum sağlayabilen,,Sorumluluk sahibi, detaylara önem veren,,Seyahat engeli olmayan,,adaylarımızın başvurularını bekliyoruz.,İŞ TANIMI,KVK kapsamında, uyum projelerinde aktif rol alınması,,Müvekkillere danışmanlık hizmeti verilmesi,,Kişisel Veri İşleme envanterlerinin oluşturulması,,Bilgi Güvenliği ve Kişisel Verileri Koruma Hukuku alanındaki diğer konularda uzman görüşlerin aktarılması,,KVKK haricinde, Şirketler ve Ticaret Hukukunun diğer alanlarında proje ve danışmanlık hizmetlerinin verilmesi,",Avukat,hukuk_avukat,,,NAZALI,
,,,"Hizmet sektöründe öncü olan firmamızda görevlendirilmek üzere; '' Hukuk  Müşaviri''   , arayışımız bulunmaktadır.,GENEL NİTELİKLER VE İŞ TANIMI,Hukuk Fakültesi mezunu,,En az 5 yıl özel sektör şirket avukatlığı ve/veya Hukuk Bürosu deneyimi olan,,Kanun ve Mevzuatlara hakim,,İş Kanunu, İcra-İflas Kanunu, Ticaret Kanunu, Borçlar Kanunu, Gümrük Kanunu, SGK Mevzuatlarına hakim ve bu konularda başarı hikayeleri olan,,Adliye ve diğer resmi kurumlardaki ilgili iş/işlemlerin takip edilmesi ve neticelendirilmesi bilgi ve tecrübesine sahip,  ,Yasal Mevzuatı ve Yargı Kararlarını güncel olarak takip eden,,Analitik düşünebilen ve planlı çalışma yeteneğine sahip,,Yoğun çalışma temposuna uyum sağlayacak, sabır düzeyi yüksek,,Yaratıcı, yenilikçi yaklaşımlara ve öğrenmeye açık,,İletişimi hızlı ve güçlü olan,,Detaylara önem veren ve çözüm-sonuç odaklı çalışabilen,,Office programlarını aktif kullanabilen,,Seyahat engeli bulunmayan,,Erkek adaylar için askerlikle ilgili süreci tamamlamış olan,, ,İŞ TANIMI,Şirketi bağlayan kanun, yönetmelik ve sair mevzuatı  incelemek, gerekli faaliyetleri başlatmak, takip etmek ve raporlamak,,Şirketimiz ve/veya şirketimiz faaliyeti ile ilgili olarak müşterilerimizin doğmuş ve doğacak dava konusu işlemlerde avukatlığını üstlenmek, süreçleri lehte sonuçlandıracak şekilde yürütmek,,Şirketimize gelen ve konusu hukuk ile ilgili olan yazışmaların karşılanması, cevaplanması ve takibini yapmak,,Şirketin taraf olduğu veya olacağı sözleşmelerin hazırlanması ve incelenmesi, onaylarının alınması ve ilgili birimlerin sözleşme süreçlerinin takibi konusunda bilgilendirmelerini gerçekleştirmek,,Danışman hukuk firmaları ve ortak iş takibi yapılan diğer şirketlerin büroları ile ortak süreçleri yönetmek, lehte sonuçlar aldırmak üzere gayret göstermek,,Hukuki işlemleri (süreç ve sonuçlarını) yönetime düzenli olarak raporlamak.",Hukuk Müşaviri,hukuk_avukat,,,Gizli Firma,
,,,"Türkiye genelinde faaliyet gösteren bir okullar zinciri için ,İzmir’de, yerleşik ,Hukuk Müşaviri ,arayışımız bulunmaktadır. ,Grup okul ve şirketlerinin faaliyetlerine yönelik ticari odaklı operasyonel destek ve stratejik rehberlik sağlama amacıyla;,- Stratejik projeler ve operasyonel konularda yasal ve hukuki öneri  sağlamak da dahil olmak üzere, tüm yasal ve mevzuat uyum konularına birincil destek vermek,,- Şirketin  bağlı olduğu iç ve dış yönerge ve yönetmeliklere, düzenlemelere ve prosedürlere (MEB, SGK, Çalışma Bakanlığı, Tarım Orman ve Köy İşleri Bakanlığı ve diğer kamu kurumları) uyulmasından sorumlu olmak.,Pozisyon, operasyonel hareket etme ve yeni proje ve süreçlerin belirlenmesi ve uygulanması da dahil olmak üzere geniş bir yelpazede stratejik olarak tavsiyede bulunma becerisine sahip güçlü bir danışmanlık bilgisi  gerektirir; hizmet sağlayıcılarla ticari anlaşmalar, rekabet hukuku ve ilgili fiyatlandırma konuları, ticaret hukuku, borçlar hukuku, kamu ihale hukuku gibi konularda hizmet verecektir.,ANA SORUMLULUKLAR,Yasal Konular :,Ticaret hukuku, Rekabet hukuku, İş Hukuku, Şirketler Hukuku, Sözleşmeler Hukuku, Borçlar kanunu  kamu ihale kanunu konularında tavsiyeler dahil olmak üzere tüm operasyonel konularda ve stratejik projelerde danışmanlık yapmak.,Servis Sağlayıcı anlaşmalarının uygulanmasını ve denetlenmesini yönetmek, servis sağlayıcı anlaşmalarının gözden geçirilmesi ve onaylanması, var olan sözleşmelerin müzakere edilmesi, yenilemeler ve fesihler hakkında danışmanlık yapmak,Grup şirketlerinin  üçüncü kişilerle imzalayacağı sözleşme, protokol vb. hukuki bağlayıcılığı bulunan tüm dokümanların usul ve esas yönünden uygun olarak hazırlamak ve / veya incelenerek hukuki görüş ve uygunluk onayını vermek,Grup şirketlerinin  faaliyet konusu ve şirketi ilgilendiren diğer konular ile ilgili yürürlükteki mevzuatı takip ederek gerekli raporlamaları hazırlanmak,İlgili tüm mevzuat değişiklikleri takip etmek ve bu değişiklikler çerçevesinde standart sözleşmeleri güncelleyerek revize etmek,Görev alanı ile ilgili tüm kayıt, evrak ve değerlerin korunmasından sorumlu olmak ve arşiv oluşturulmasını sağlamak,Gerektiğinde dış müşavir ve avukatların  katılımıyla ihtilaf ve davaları yönetmek,Mevzuat Uyum Konuları ,: ,Aşağıdakiler dahil olmak üzere Okul Yönetimi ekibi ile işbirliği içinde, operasyonlar  için MEB uyum süreçlerinin uygulanması ve işletilmesi.,- MEB’in yayınladığı  yönetmelik ve yönergeleri takip etmek,- Akademik  alanda  araştırma, eğitim, sponsorluk / bağış, danışmanlık  ve yurt içi ve yurtdışı  eğitim işbirliklerini içeren  sözleşmeler ile okullar ve eğitim ile ilgili diğer düzenlemeler gibi  mevzuat  konularında danışmanlık yapılması,Aranan Özellikler: ,- Farklı seviyelerde kolaylıkla iletişim kurabilen kişiler arası iletişim becerisi,- Bağımsız çalışabilme, ticari düşünebilme ve hem pratik hem de zamanında karar alabilme,- Güçlü müzakere becerisi ,- İç ve dış müşterilere müşteri odaklı hizmet sunabilme,- Özerk olarak çalışabilir ancak aynı zamanda iyi bir takım oyuncusu,- Kurum içi  karar vericilerle uyumlu  çalışabilme becerisi,Deneyim ve Bilgi :,- Ticari bir ortamda en az 5 yıl yasal deneyim.,- Tercihen sektör deneyimi (özel okul veya dershane),Nitelikler:,- Lisans derecesinde Hukuk diploması (bir Türk Üniversitesinden veya başka bir ülkedeki akredite hukuk fakültesinden denklik),- Tercihen Ticaret Hukukunda ihtisas eğitimi, , ",Hukuk Müşaviri,hukuk_avukat,,,Gizli Firma,
,,,"·,         ,Üniversitelerin Hukuk Fakültelerinden mezun,,·,         ,Ticaret Hukuku, İş Hukuku, Sosyal Güvenlik Mevzuatı ve İcra Hukuku konularında en az 5 yıl deneyimli,,·,         ,İleri seviyede İngilizce bilgisine sahip (sözlü ve yazılı mülakat yapılacaktır / pozisyon aktif dil bilgisi kullanımı gerektirmektedir),,·,         ,MS Office programlarını, UYAP ve hukuk yazılımlarını iyi derecede kullanabilen,,·,         ,Takipçi, hızlı, zaman yönetimi konusunda etkin ve planlama yeteneği gelişmiş,,·,         ,Yoğun iş temposuna uyum sağlayabilen,,·,         ,Sözlü ve yazılı iletişim yeteneği güçlü,,·,         ,Yurtiçi ve Yurtdışı seyahat engeli olmayan,,·,         ,Askerlik hizmetini tamamlamış (tecilli başvurular dikkate alınmayacaktır).,İŞ TANIMI,·,         ,Şirketimiz bünyesindeki fabrika ve şantiyelere iş hukuku konusunda ilgili personele gerekli eğitimlerin verilmesi ve yönlendirmelerin yapılması, ,·,         ,Yapılan işlemlerin İş Hukuku ve Sosyal Güvenlik mevzuatına uygunluğunun denetlenmesi,,·,         ,Sözleşmelerin hazırlanması, yorumlanması, dava ve icra süreçlerinin takibi,,·,         ,Şirket içi birimlere hukuki görüş ve destek verilmesi.,*** Anlaşma sağlayacağımız aday şirketimiz bünyesinde ,tam zamanlı, olarak görev alacak olup sözleşmeli avukat olarak çalışmayacaktır.",Şirket Avukatı ,hukuk_avukat,,,Şara Enerji İnşaat Tic. ve San. A.Ş.,
(Belirtilmemiştir),Sürekli / Tam zamanlı,,"Ofisimiz bünyesinde, Yönetici Avukat ve Partnerlara bağlı olarak;  ,“Legal Operations Assistant”, pozisyonunda çalışacak bir ekip arkadaşı arıyoruz.,Genel Nitelikler,Özmotivasyonu yüksek,  ,Yeniliklere ve gelişime açık, ,Tercihen iyi derecede MS Office programlarını kullanan, ,İletişime ve takım çalışmasına önem veren, ,İyi derecede İngilizce bilgisine sahip, ,Proaktif, çözüm odaklı ve analitik bakış açısına sahip, ,Organizasyon, zaman yönetimi ve koordinasyon konusunda kendisine güvenen.,Görev Tanımı ,Bağlı olduğu yöneticilerin takvimlerinin güncel tutulmasını sağlamak, ,Tracking System üzerinden gerekli zaman kayıtlarının oluşturulmasını sağlamak, ,Kendisinden istenen düzen ve sıklıkta zaman raporlarını yöneticileri ile paylaşmak, ,Gerektiğinde bağlı olduğu yöneticilerin belirleyeceği format ve sıklıkta raporlar sunmak, ,Bağlı olduğu yöneticilerin sorumlulukları dahilindeki müvekkillerle iletişime destek olmak. ",Legal Operations Assistant,hukuk_avukat,,Avukatlık ve Hukuki Danışmanlık , BTS DANIŞMANLIK HİZMETLERİ A.Ş. ( BTS & Partners),Tecrübeli ya da tecrübesiz adaylar
,,,"İstanbul Kağıthane Z-Ofis'de Bulunan Arabuluculuk Şirketimizde Görevlendirilmek Üzere,Üniversitelerin Hukuk Fakültelerinden Mezun,En Az 5 Yıl Tecrübeli,Arabuluculuk Sertifikasına Sahip,Planlama ve Takip Yeteneği Güçlü, Raporlama ve Koordinasyonu Sağlayabilecek,Seyahat Engeli Olmayan,Tercihen İngilizce Bilen,İş Disiplinine Önem Veren, Ekip Çalışmasında Uyumlu,,""Arabulucu Avukat"" Aramaktayız.",Arabulucu Avukat,hukuk_avukat,,,Sektöründe Lider Firma,
Sürekli / Tam zamanlı,Hukuk,"Üniversite(Mezun), Yüksek Lisans(Mezun)","     ,Üniversitelerin Hukuk bölümünden mezun, Baroya Kayıtlı,,     ,2-5 yıl tecrübesi olan,,     ,Özellikle  Fikri Mülkiyet Hukuku,  İş Hukuku,  Borçlar Hukuku, konularında tecrübeli olan,     Dava takip deneyimi olan,     İletişimi kuvvetli ve sonuç odaklı,,     ,Düzenli,İş disiplini yüksek, zaman yönetiminde başarılı,,     İyi Derecede İngilizce bilen,,İŞİN TANIMI,     ,Şirketin taraf olduğu Fikri Mülkiyet Hukuku başta olmak üzere sözleşmelerin hazırlanmasını ve sözleşme süreçlerinin takibi,,     Dava ve icra dosyalarının takibi,,     ,Takip edilen dosyaların düzenlenmesi,,     ,Şirketin idari mercilerle olan yazışmalarının yürütülmesi,,     ,Mevzuat takibi,",Avukat,hukuk_avukat,İstanbul(Avr.)(Şişli),Diğer,Sektöründe Lider Firma,2 - 5 yıl tecrübeli adaylar
,,,"Job description,Legal department within company,·,         ,Managing control and research of contracts, judicial and administrative correspondence,,·,         ,Following and report all kinds of legal disputes, conflicts and lawsuits,,·,         ,Establishing policies, principles and form requirements for contract making according to the types of contracts,,·,         ,Do the filing, follow up, renew or update contracts with additional protocols, and arrange termination protocols if necessary,,·,         ,Checking  the fulfillment of the rights and obligations arising from the contracts, and to discuss a related legal matter on the disputes,·,         ,Carrying out lawsuits, enforcement proceedings and other external legal transactions, ,Wanted attributes,·,         ,Good command of legal and technical English,·,         ,Dominate the legislation of Commercial Law, Labor Law, Law of Obligations and Execution & Bankruptcy Law,,·,         ,Experienced corporate lawyer,·,         ,Strong representation and business follow-up,·,         ,We are looking for experienced and inexperienced lawyers., , ",Lawyer/Avukat ,hukuk_avukat,,,BORADEN BAĞIMSIZ DENETİM VE DANIŞMANLIK A.Ş.,
Sürekli / Tam zamanlı,Hukuk,Hukuk,"         ,Üniversitelerin hukuk fakültelerinden mezun,,         ,Avukatlık ruhsatı olan,,         ,İş Hukuku ve İdare Hukuku konularında tecrübeli,,         ,Mevzuat takibi yapabilecek,,         ,Firma bünyesinde hukuki süreçlerin yürütülmesinde minimum 10 yıl deneyimli,,         ,Üniversite ve kurum avukatlığı deneyimi olan,,         ,Ms Office programlarını iyi derecede kullanabilen,,         ,Ekip liderliği tecrübesi olan,,         ,Çözüm odaklı ve detaylara önem veren,,         ,Anadolu Yakasında ikamet eden,,Üniversitemiz Hukuk Müşavirliği bünyesinde tam zamanlı çalışmak üzere Hukuk Müşaviri alımı yapılacaktır.",Hukuk Müşaviri,hukuk_avukat,İstanbul(Asya)(Kadıköy),Eğitim,Sektörün Öncü Kuruluşu,10 - 20 yıl tecrübeli adaylar
