calisma_sekli,departman,egitim,genel_nit_is_tanimi,ilan_baslik,label,sehir,sektor,sirket_adi,tecrube
,,,"Türkiye’de sağlık sektöründe başarılı bir geçmişe sahip Medipol Sağlık Grubu’nun Kadıköy’de hizmet veren Medipol Hastanesi’nde görevlendirilmek üzere;,
 ,
,Tercihen lisans, en az MYO mezunu, ,Sağlık sektöründe ‘Hasta Kayıt Kabul’ pozisyonunda çalışmış, ,SGK, özel sağlık sigortası ve anlaşmalı kurumlar bilgisine sahip, ,Yeniliğe ve öğrenmeye açık, ,Dış görünümüne ve kişisel hijyenine önem veren, ,İlgili alanda en az 1-2 yıl deneyimli, ,Takım çalışmasına yatkın, ,Ms Office programlarına hakim, ,Hasta ve hasta yakınlarıyla etkili iletişim kurabilen aynı zamanda empati kurma becerisine sahip,,Hasta memnuniyetine önem veren, ,Vardiyalı çalışabilicek, ,Sabırlı, güler yüzlü ve dinamik, ,Anadolu yakasında ikamet eden, ,'Hasta Kayıt Kabul Görevlisi',İŞ TANIMI,
,Kurumumuzun verdiği hizmetlerinden faydalanmak üzere gelen hastalara gerekli bilgileri aktaracak,,Hastaların kabul işlemleri için gerekli hazırlıkları tamamlayacak, ,Hizmetlerimizden  faydalanan/faydalanacak hastaların ödemesini alacak ve faturasını kesecek,,Hastanın ödemesiyle ilgili evrakların eksiksiz olduğunu kontrol ederek teslim edecek,,Gün sonunda ilgili bölüme kasa teslimi yapacak. ",HASTA KAYIT KABUL GÖREVLİSİ,saglik,,,Özel İstanbul Medipol Hastanesi,
,,,"·,         Tercihen ,20-35 yaşları arası Bayan
,·,         ,Lise mezunu , tercihen lisans düzeyinde estetisyenlik sertifka sahibi,·,         ,Cilt Bakımı ,Lazer Epilasyon,Zayıflama hizmetlerinde az 3 yıl deneyimli,,·,         ,Dış görünümüne özen gösteren,prezentabl,,·,         ,Hasta memnuniyetine önem veren, iletişim yeteneği güçlü, ",Estetisyen,saglik,,,LADONNA ESTETİK,3 - 5 yıl tecrübeli adaylar
,,"Üniversite(Mezun), Yüksek Lisans(Öğrenci), Yüksek Lisans(Mezun), Doktora(Öğrenci), Doktora(Mezun)","Ethica Sağlık Grubu 2 genel hastanesi, 2 tıp merkezi ve sağlık alanında yeni yatırım projeleriyle hizmet kalitesini ve hasta memnuniyetini ön planda tutan, profesyonel kadrosu ve son teknoloji cihazlarıyla Türkiye'nin önde gelen bir sağlık kuruluşudur. Ethica markasıyla genel hastanecilik ve Estethica markasıyla da estetik-plastik cerrahi alanlarında dünyanın önde gelen sağlık kuruluşları arasında yer almayı hedef belirlemiş, yurtdışı yatırım projeleriyle bu hedeflerine doğru hızla yol almaktadır. Öncülük ettiği sosyal sorumluluk projeleriyle de ülkemizin dünya çapındaki hedeflerine hizmet etmektedir. ,İŞ TANIMI,Ethica Sağlık Grubu'na bağlı Ethica İncirli Hastanemiz bünyesinde görevlendirilmek üzere, ,Eczacılık fakültesi mezunu, ,Hastane bünyesinde bulunan eczanelerde minimum 2 yıl çalışmış,,Hastane eczanesi işleyiş ve süreçlerine hakim,,Takım çalışmasına yatkın,,İstanbul Avrupa yakasında ikamet eden, , ,""Eczacı"" ,arayışımız bulunmaktadır.",Eczacı ,saglik,,,İNCİRLİ SAĞLIK VE SOSYAL TESİSLER A.Ş.,En az 2 yıl tecrübeli adaylar
,,,"Hospitadent Dental Group ,Asya (Çamlıca, Pendik) &, ,Avrupa Yakası ,(Bağcılar, Fatih, Bakırköy, Mecidiyeköy) ,  ve ,Kayseri ,şubelerinde değerlendirilmek üzere;,Tanı ve tedavi yaklaşımları konusunda bilgi ve deneyim sahibi, ,İletişim yeteneği güçlü, ,Hasta memnuniyetine önem veren, ,En az 2 yıl deneyimli, ,Tam zamanlı çalışabilecek Staff Diş Hekimi, ,Pedodonti, Protez, Endodonti, Ortodonti, Periodontoloji vb. ,'Diş Hekimleri ve Uzman Hekimler' ,aranmaktadır.,İŞ TANIMI,Ağız ve Diş Sağlığının öncü ve lider kuruluşu olan grubumuz, yurtiçinde 7 yurtdışında 2 şubesiyle hastalarını gülümsetmeye; ,“Bütün İşimiz Diş”, çalışma anlayışı, ,“Biz Gülümsetmeyi Seviyoruz”, felsefesiyle ve alanında uzman çalışanlarıyla hizmet vermeye devam etmektedir. Ağız ve Diş Sağlığı alanında tecrübe edinmiş hekimler tarafından 2004 yılında kurulan Bağcılar şubemiz, gördüğü yoğun ilgi üzerine, ,Dental Sağlık Turizmi, ile de büyüme ivmesini arttırarak, Hospitadent Dental Group çatısı altında, Bağcılar, Fatih, Çamlıca, Pendik, Mecidiyeköy, Bakırköy, Frankfurt, Kayseri, Utrecht, Ürdün  ve  Şerifali ,olmak üzere toplamda,11, şubeye ulaşmıştır.,Hasta ve hasta yakınlarına yüksek kalitede hizmet verilmesini ilke edinen ve benimseyen grubumuzda;,Genel ve uzman diş hekimliği ile ilgili  tüm hizmetleri vermek, ,Hastaların klinik randevularını vermek ve takip etmek, ,Verilen hizmetin kalitesini artırmaya çalışıp her türlü hasta memnuniyetini sağlamak,,Hastaların post-op takibini yapmak. ",Diş Hekimi - Uzman Diş Hekimi,saglik,,,Hospitadent Dental Group,
,,"Ön Lisans(Öğrenci), Ön Lisans(Mezun), Üniversite(Öğrenci), Üniversite(Mezun), Yüksek Lisans(Öğrenci), Yüksek Lisans(Mezun), Doktora(Öğrenci), Doktora(Mezun)","* Üniversite mezunu,,* İlaç sektöründe spesifik ürünlerin satış gruplarında en az 4 yıl tecrübeli,,* MS Office programlarını kullanabilen,,* Sürücü belgesine sahip ve aktif araç kullanabilen,,* Seyahat engeli bulunmayan,,* ÜTE Sertifikası bulunan,,* Erkek adaylar için askerlik hizmetini tamamlamış,,* İstanbul Asya ve Avrupa, Bursa, İzmir, Adana, Antalya ve Ankara ilinde ikamet eden,,Yeni kurulacak ürün grubumuzda görevlendirilmek üzere Tıbbı Tanıtım Uzmanı arayışımız bulunmaktadır.",Tıbbı Tanıtım Uzmanı,saglik,,,Sektöründe Lider Firma,En az 4 yıl tecrübeli adaylar
,,," İŞ TANIMI, ,Üniversitelerin hemşirelik bölümünden mezun (en az Önlisans mezunu),  ,Branşı ile ilgili gelişme ve yenilikleri takip eden, ,Ekip çalışmasına yatkın, ,Esnek çalışma saatlerine uyum sağlayabilecek,,Hasta güvenliği ve hasta memnuniyetini ön planda tutan,,İletişim yeteneği kuvvetli, ,Pendik Medipol Üniversite Hastanesi,'nde görevlendirilmek üzere ‘,’Hemşire’’, arayışımız mevcuttur.",HEMŞİRE / PENDİK MEDİPOL ÜNİVERSİTE HASTANESİ,saglik,,,MEDİPOLİTAN SAĞLIK VE EĞİTİM HİZM. A.Ş.,
,,,"TS EN ISO 17025 Standardı çerçevesinde Gıda Analizi Hizmeti veren    Laboratuvarımızda görevlendirmek üzere ,,Üniversitelerin Kimya, Kimya Mühendisliği, Gıda Mühendisliği bölümlerinden        mezun,,Erkek adaylar için askerlik görevini tamamlamış,,Gıda Analizleri konusunda gelişmeye açık istekli,,Çalışma arkadaşı aramaktayız.,Adayların, ,- Laboratuvar alanında 1-2 yıl tecrübeli olması,,- Enstrumantal cihaz tecrübesi olması,,- Pestisit alanında çalışmış LC-MSMS ve GC-MSMS kullanmış olması,,-Öncelikli tercih nedenidir.",Laboratuvar Elemanı,saglik,,,Radix Analiz Laboratuvar Hizmetleri Ticaret A.Ş.,
Eleman,Sürekli / Tam zamanlı,Hemşirelik,"
,Hemşirelik Lisans mezunu,,
,Ameliyathane alanında en az ,2 yıl, deneyimli,,
,Ekip çalışmasına yatkın,,
,Hasta memnuniyetine önem veren,,
,İş Tanımı,
,Bölüme gelecek hasta ile ilgili bilgi edinmek ve gerekli hazırlıkları tamamlamak,,
,Hastanın gereksinimleri doğrultusunda hemşirelik bakımlarını planlamak ve uygulamak,,
,Bölümdeki cihazların işler halde olmasını, kullanılan alet ve setlerin steril edilmelerini sağlamak,,
,Hemşirelik hizmetini etik kurallar içerisinde sunarak mesleki kalitenin gelişmesine katkı sağlamak.,
",Deneyimli Ameliyathane Hemşiresi,saglik,,Sağlık,Acıbadem Sağlık Grubu,En az 2 yıl tecrübeli adaylar
,,,"Esteworld Plastik Cerrahi Sağlık Grubu, İstanbul'da Bahçelievler ve Altunizade bölgelerinde 3 şubesi ile 2004 yılından bu yana faaliyet gösteren estetik ve plastik cerrahi konusunda branşlaşmış bir sağlık kuruluşudur. 2014 yılında, Altunizade'de hizmete giren Estetik Cerrahi Kompleksi ile yatırımlarına devam eden Esteworld, Türkiye'de yüksek bir ivme ile gelişen sağlık sektörü hizmetlerini, ülkemizin temsilini en iyi şekilde yapacak anlayışla sunma amacındadır. Türkiye geneli dışında, 100'ün üzerinde ülkede  temsilcilikle hastaya hizmet veren Esteworld, Avrupa'nın ve Dünya’nın plastik cerrahi ve  estetik konusunda branşlaşmış sayılı sağlık grupları arasında bulunmaktadır.,Esteworld Plastik Cerrahi Sağlık Grubu ,Altunizade Hastanesinde, görevlendirilmek üzere;,Üniversite veya Sağlık Meslek Liselerinin, hemşirelik, sağlık memurluğu bölümlerinden mezun,,En az 2 yıl deneyimli,, ,Tercihen İngilizce dil bilgisine sahip, ,İletişim yeteneği güçlü, araştırma ve gelişime açık,  ,Ekip çalışmasına  yatkın, ,Vardiyalı çalışma düzenine uyum sağlayabilecek, ,Hasta memnuniyetine önem veren, ,Branşı ile ilgili gelişme ve yenilikleri takip eden, ,Tam zamanlı çalışacak, ,Sigara kullanmayan, ,Bayan. ,"" Servis Hemşiresi"" aranmaktadır., , , ,İŞ TANIMI,Esteworld Plastik Cerrahi Sağlık Grubu Altunizade Hastanesinde görevlendirmek üzere,'Servis Hemşiresi' ,aranmaktadır., ",SERVİS HEMŞİRESİ,saglik,,,ESTEWORLD SAÇ EKİMİ VE PLASTİK CERRAHİ SAĞLIK GRU,
,,,"Yedikule Surp Pırgiç Ermeni Hastanesinde görevlendirilmek üzere;,Hemşirelik Sağlık Yüksek Okulu veya Sağlık Meslek Lisesi mezunu, ,En az iki yıl ameliyathane hemşiresi olarak çalışmış, ,Hasta ve hasta yakınlarının memnuniyetine önem veren, ,Kişisel bakımına ve dış görünüşüne özen gösteren, ,Takım çalışmasına yatkın, güler yüzlü, ,Mesleğin de kariyer hedefi olan, , Tecrübeli Ameliyathane Hemşiresi alınacaktır.",Ameliyathane Hemşiresi,saglik,,,Yedikule Surp Pirgiç Hastanesi,
Sürekli / Tam zamanlı,Sağlık,"Lise(Mezun), Ön Lisans(Öğrenci), Ön Lisans(Mezun), Üniversite(Öğrenci), Üniversite(Mezun), Yüksek Lisans(Öğrenci), Yüksek Lisans(Mezun), Doktora(Öğrenci), Doktora(Mezun)","
,Sağlık Meslek Liseleri veya Üniversitelerin Hemşirelik bölümlerinden mezun, ,En az 5 yıl mesleki deneyime, tercihen  minimum 2 yıl sorumlu hemşirelik deneyime sahip,,Alanındaki yenilikleri ve gelişmeleri takip ederek işine adapte eden, ,Hekimler ile hastalar arasında koordinasyonu gerçekleştirebilecek, ,Olumlu iletişim becerilerine sahip, kendini iyi ifade edebilen, ,Organizasyon ve koordinasyon becerisi gelişmiş,  ekip çalışmasına yatkın, ,Hasta güvenliği ve hasta memnuniyetini ön planda tutan, ,Hasta  bakımı ile ilgili kritik kararlar alabilme ve analitik düşünebilme becerisine sahip,,Etkili zaman yönetimi yapabilen, etkin ve hızlı karar verebilen, planlama ve uygulama becerilerine sahip,,Mesleki gelişme, yeniliklere ve değişime açık, ,Farklı ameliyatlarda görev almış, ,Yoğun iş temposuna alışkın, ,Erkek adaylar için askerlik hizmetini tamamlamış ,İŞ TANIMI, “,” a,
,Ameliyathane ünitesinde hemşirelik hizmetlerinin kalite standartlarına ve yasalara uygun şekilde hizmet vermesini sağlamak,,Verimlilik ve süreklilik esasına göre süreçleri planlamak, organize etmek, denetlemek, yönetmek,,Hemşirelik hizmetlerinin sürekli gelişimine katkı sağlamak amacı ile ekibine eğitimler vermek, verilmesini sağlamak.,Kendisine bağlı hemşirelerin performans değerlendirme sürecinden sorumlu olmak.",Ameliyathane Sorumlu Hemşiresi,saglik,İstanbul(Avr.),Sağlık,BCT ESTETİK SAĞLIK TUR. VE DAN. HİZM. TİC. LTD. ŞTİ.,5 - 10 yıl tecrübeli adaylar
Eleman,Sürekli / Tam zamanlı,,"Üniversite veya Meslek Yüksekokul mezunu, ,Tercihen sağlık sektöründe deneyimli,,MS Office programlarını kullanabilen,,İnsan ilişkilerinde başarılı,,Ekip çalışmasına yatkın, ,Prezantabl,   , İŞ TANIMI ,Hasta verilerinin günlük olarak ilgili sisteme girilmesi, ,Merkeze başvuran hasta ve hasta yakınlarının karşılanması, randevu verilmesi,,Tetkik için bekleyen hastaların takibinin yapılması ve bilgi verilmesi,,Kurum evrakları düzenlenerek günlük kasanın tutularak ön muhasebe işlemlerinin yapılması,,Bölüme ait araç, gereç ve ekipmanlar ile eksikliklerin belirlenerek bağlı bulunduğu yöneticinin onayını alarak kullanılan sistem üzerinden talep yapılmasının sağlanması, ,Bilgi, istem formları ve raporların arşivlenmesinin sağlanması.  ",Hasta Kabul Yetkilisi,saglik,,"Holding / Şirketler Grubu, Sağlık Hizmetleri, Sağlık",BOZLU HOLDİNG A.Ş.,
,,,"·,Sağlık Meslek Lisesi veya Sağlık Yüksekokulu Hemşirelik bölümü mezunu,,·,En az 2 yıl Ameliyathane Hemşireliği deneyimi olan,,·,Eğitim ve gelişime açık,,·,Hasta güvenliği ve hasta memnuniyetini ön planda tutan,,·,Güler yüzlü ve iletişim yeteneği kuvvetli,,·,Ekip çalışmasına uyumlu,,Ameliyathane Hemşiresi, pozisyonu için arayışımız bulunmaktadır.,Not: Bayan çalışanlarımız için lojman imkanımız bulunmaktadır., ",AMELİYATHANE HEMŞİRESİ,saglik,,,Kozyatağı Central Hospital,
,,,"Sevgili Adayımız,,• Üniversitelerin Tıp fakültelerinden mezun isen, ,• Minimum 2 yıllık provizyon tecrüben varsa,,• Kariyerine Sigortacılık sektöründe devam etmek istiyorsan, ,• İletişim becerine güveniyorsan, ,• Takım çalışmasına yatkınsan, ,• Müşteri ve hizmet odaklıysan, , • Analitik düşünme ve problem çözme yetkinliklerine güveniyorsan, ,• İş sorumluluğun yüksekse, dinamik ve yoğun çalışma ortamına uyum sağlayabileceksen, ,• Askerliğini tamamladıysan ya da en az 2 yıl tecilin varsa, ,İŞ TANIMI ,• Sağlık provizyon süreçlerinin organizasyon ve koordinasyonuna fikir katkısı sağlarken kompleks ve yüksek tutarlı provizyon dosyalarını bizzat değerlendiririm, ,• Anlaşmalı Sağlık Kurumları’ndan gelen kompleks provizyon taleplerini değerlendirir ve zaman kısıtı içerisinde yanıtlarım, ,• Provizyon Merkezi’ndeki hemşireler ya da non-medikal personeller tarafından değerlendirilen dosyalar için danışmanlık veririm, ,• Dış müşteri istek, şikayet ve önerilerini değerlendirir ve yanıtlarım, ,• Diğer birimlerle ortak ürün, süreç geliştirme ve iyileştirme faaliyetleri ile projelere katkı sağlarım, ,• Risk kabul süreçlerine destek olurum, ,• Anlaşmalı sağlık kurumlarına görüş veririm,,Diyorsan, Groupama Sigorta ailesinde yerini alman için bir tık uzağında başvurunu bekliyoruz. ,BİZ’e katılırsan; ,• Yan haklarını esnek şekilde kullanabilir, ,• Evden çalışma uygulamasından faydalanabilir, ,• Sigortacılık sektörünü tecrübeli yöneticilerden derinlemesine öğrenebilir, ,• Yurtdışı kariyer fırsatlarından faydalanabilir, ,• İşe uygun günlük kıyafetlerinle çalışabilir,  ,• Samimi ve çalışan odaklı bir iş ortamının keyfini yaşayabilirsin. ,Haydi gel, katıl BİZ’e! Gelecek BİZ’im elimizde…",Danışman Doktor,saglik,,,Groupama Sigorta ve Hayat A.Ş,
Uzman,Sürekli / Tam zamanlı,,"Medilife Sağlık Grubu'na bağlı Çapa'da bulunan hastanemizde görevlendirilmek üzere;,Tercihen en az ön lisans mezunu, ,Tercihen Hasta Danışmanı/Doktor Asistanı olarak min. 1 yıl deneyimli veya sağlık sektöründe kendini geliştirmek isteyen,,İngilizce dili ,okuma, yazma, konuşma, bilgisine hakim,,Dış görünümüne özen gösteren, bakımlı, ,İletişimi kuvvetli, güler yüzlü, ,Ekip çalışmasına yatkın, ,Stres yönetimi yapabilme becerisine sahip,,Çapa ve/veya çevresinde ikamet eden,,"",İngilizce Bilen Hasta Danışmanı,"" arayışımız bulunmaktadır.",İngilizce Bilen Hasta Danışmanı,saglik,,Sağlık,Medilife Sağlık Grubu,
Uzman,Sürekli / Tam zamanlı,,"Medilife Sağlık Grubu'na bağlı  Beylikdüzü'nde bulunan hastanemizde görevlendirilmek üzere;,Lisans mezunu, ,Tercihen sağlık sektöründe tecrübeli veya kendini geliştirmek isteyen,,İngilizce ,okuma, yazma, konuşma bilgisine hakim,,Tercihen ikinci olarak, Arapça, diline hakim,,Dış görünümüne özen gösteren, bakımlı, ,İletişimi kuvvetli, güler yüzlü, ,Ekip çalışmasına yatkın, ,Stres yönetimi yapabilme becerisine sahip,,"",İngilizce Tercüman,"" arayışımız bulunmaktadır.",Tercüman (İngilizce),saglik,,Sağlık,Medilife Sağlık Grubu,
Uzman,Sürekli / Tam zamanlı,,"Bağcılar,
,Hemşirelik ,bölümü mezunu, ,Ameliyathane hemşireliğinde en az 2 yıllık deneyime sahip, ,Farklı ameliyatlarda görev almış, ,Yoğun iş temposuna alışık, ,Ekip çalışmasına uyum sağlayabilecek, ,Ameliyathane Hemşiresi",Ameliyathane Hemşiresi,saglik,,Sağlık,"Özel Beylikdüzü Medilife Hastanesi - Yonca Sağlık Hizmetleri Ltd.Şti. -Medilife Sağlık Grubu- MEDİLİFEDENT, MEDİLİFE AİLE SAĞLIĞI MERKEZ, ÖZEL ÇAPA MEDİLİFE, MEDİLİFE AİLE SAĞLIĞI",
Uzman,Sürekli / Tam zamanlı,"Lise(Mezun), Ön Lisans(Öğrenci), Ön Lisans(Mezun), Üniversite(Öğrenci), Üniversite(Mezun), Yüksek Lisans(Öğrenci), Yüksek Lisans(Mezun)","Medilife Sağlık Grubu'na bağlı ,Beylikdüzü ,Hastanemizde görevlendirilmek üzere,
,
,Hemşirelik bölümü mezunu, ,Erişkin Yoğun Bakım Birimi'nde en az 2-3 yıl tecrübeli, ,Yoğun çalışma temposuna uyum sağlayabilecek, ,İnsan ilişkilerinde başarılı, ,Ekip çalışmasına yatkın, ,Tercihen Beylikdüzü ve çevresinde ikamet eden, ,Erkek adaylarımız için askerlik görevini tamamlamış, ,"",Erişkin Yoğun Bakım Hemşiresi,"" arayışımız bulunmaktadır.",Erişkin Yoğun Bakım Hemşiresi,saglik,,"Sağlık, Sağlık Kuruluşları, Hastaneler, Sağlık Hizmetleri",Medilife Sağlık Grubu,Tecrübeli ya da tecrübesiz adaylar
,,,"İŞ TANIMI,"" Altunizade Kliniğimizde', ,En az lise tercihen lisans düzeyinde estetisyenlik eğitimi almış, ,Uzman estetisyen veya  estetisyenlik belgesi sahibi, ,Branşı ile ilgili özel eğitimler ve güncel uygulamalar ile kendisini sürekli geliştiren ve yenilikleri takip eden,,Cilt Bakımı ,Lazer epilasyon,Zayıflama uygulamalarında en az 2 yıl deneyimli,,İkna kabiliyeti kuvvetli, ,İletişim yeteneği güçlü, sunum becerisi gelişmiş, diksiyonu düzgün, ,Gelişime açık ve sorumluluk sahibi, ,Dış görünümüne özen gösteren, bakımlı, prezentabl, ,Ekip çalışmasına yatkın, ,Hasta memnuniyetine önem veren, ,""Uzman Estetisyen"" ",ESTETİSYEN,saglik,,,ESTEWORLD SAÇ EKİMİ VE PLASTİK CERRAHİ SAĞLIK GRU,
,,,"Genel Yoğun Bakım'da görevlendirilmek üzere Hemşire olarak görev yapacak GYB Hemşiresi aramaktayız. ,Hemşirelik Yüksekokulu ya da Sağlık Meslek Lisesi mezunu,,Alanında en az 2 yıl deneyimli, ,Ekip çalışmasına yatkın, ,Hasta memnuniyetine önem veren, ,Güler yüzlü Erkek adaylar için askerlik hizmetini tamamlamış,",Hemşire,saglik,,,Cihan Özel Sağlık ve Eğt. Hiz. İnş. San. A.Ş.,
,,,"Özel Neon Hastanesi  ,
Üroloji Uzmanı ,İŞ TANIMI,
,Hasta memnuniyeti odaklı çalışmayı ilke edinmiş, ,Branşının gerektirdiği vizyona sahip,  ,Bilimsel gelişmeleri takip eden, ,İletişim yeteneği güçlü ,Tam zamanlı çalışabilecek. ",Üroloji / Bevliye Uzmanı,saglik,,,ERGAN İHTİYAÇ GIDA ÜRÜNLERİ İNŞ.NAK.SAĞ.PAZ.SAN.A.,
,,,"Özel Neon Hastanesi  ,bünyesinde değerlendirilmek üzere ,
Radyoloji Uzmanı, ,aramaktayız.,* Branşı ile ilgili gelişmeleri takip eden,*Tanı , tedavi ve yaklaşımlar konusunda bilgi ve deneyim sahibi,* Hasta memnuniyeti odaklı çalışmayı ilke edinmiş,*İletişim yeteneği güçlü",Radyoloji Uzmanı,saglik,,,ERGAN İHTİYAÇ GIDA ÜRÜNLERİ İNŞ.NAK.SAĞ.PAZ.SAN.A.,
,,,"Özel Neon Hastanesi  ,bünyesinde değerlendirilmek üzere,P,ratisyen Hekim ,aramaktayız.,İŞ TANIMI,Hasta memnuniyeti odaklı çalışmayı ilke edinmiş, ,Branşının gerektirdiği vizyona sahip,  ,Bilimsel gelişmeleri takip eden, ,İletişim yeteneği güçlü ,Tam zamanlı ve nöbet sistemi ile  çalışabilecek. ",Pratisyen Hekim,saglik,,,NEON HASTANESİ,En çok 10 yıl tecrübeli adaylar
,,,"
,Hemşirelik ,Lisans ,mezunu, ,Ekip çalışmasına yatkın, ,Hasta memnuniyetine önem veren, ,Erkek adaylar için tercihen askerlik hizmetini tamamlamış,  ,Çalışanlarımız için ücretsiz lojman imkanı sunmaktayız,.,İŞ TANIMI,
, Bölüme gelecek hasta ile ilgili bilgi edinmek ve gerekli ilaç, cihaz, malzeme ve alet hazırlıklarını tamamlamak,,Hastayı karşılamak, işlem veya muayene için gerekli ilk işlemleri gerçekleştirmek,,Hekim istemi doğrultusunda hastanın tedavisini planlamak, uygulamak ve uygulama sonucunda hastanın durumunu izleyerek değerlendirmek,,Hastadan topladığı verileri ve hastanın genel durumundaki değişiklikleri değerlendirmek, kaydetmek ve normalden sapmaları hekime bildirmek,,Hemşirelik hizmetini etik kurallar içerisinde sunarak mesleki kalitenin gelişmesine katkı sağlamak.",Hemşire - Avrupa Yakası,saglik,,,Acıbadem Sağlık Grubu,
Sürekli / Tam zamanlı,Sağlık,,"Lise veya önlisans mezunu, ,Tercihen hasta bakımı konusunda tecrübeli, ,Hasta ve hasta yakınlarının memnuniyetini işinin her aşamasında ön planda tutabilecek,,Ekip çalışmasına yatkın, ,Vardiyalı çalışabilecek. ,İŞ TANIMI",Hasta Bakıcı-Anadolu Yakası,saglik,İstanbul(Asya),Sağlık,Acıbadem Sağlık Grubu,En çok 10 yıl tecrübeli adaylar
,,,"Lise veya önlisans mezunu, ,Tercihen hasta bakımı konusunda tecrübeli, ,Hasta ve hasta yakınlarının memnuniyetini işinin her aşamasında ön planda tutabilecek,,Ekip çalışmasına yatkın, ,Vardiyalı çalışabilecek. ,İŞ TANIMI",Hasta Bakıcı-Avrupa Yakası,saglik,,,Acıbadem Sağlık Grubu,
,,,"
, Hemşirelik Lisans mezunu, , Yeni mezun ya da deneyimli, , Ekip çalışmasına yatkın, , Hasta memnuniyetine önem veren, , Erkek adaylar için askerlik hizmetini tamamlamış yada 2 yıl tecilli,  ,Çalışanlarımız için ücretsiz lojman imkanı sunmaktayız,.,İŞ TANIMI,
, Bölüme gelecek hasta ile ilgili bilgi edinmek ve gerekli ilaç, cihaz, malzeme ve alet hazırlıklarını tamamlamak,,Hastayı karşılamak, işlem veya muayene için gerekli ilk işlemleri gerçekleştirmek,,Hekim istemi doğrultusunda hastanın tedavisini planlamak, uygulamak ve uygulama sonucunda hastanın durumunu izleyerek değerlendirmek,,Hastadan topladığı verileri ve hastanın genel durumundaki değişiklikleri değerlendirmek, kaydetmek ve normalden sapmaları hekime bildirmek,,Hemşirelik hizmetini etik kurallar içerisinde sunarak mesleki kalitenin gelişmesine katkı sağlamak.",Hemşire - Anadolu Yakası,saglik,,,Acıbadem Sağlık Grubu,
,,,"Medipol Üniversitesi Fındıkzade Hastanesinde görevlendirilmek üzere;,·         ,Mesleğinde en az 2 yıl deneyimli,,·         ,Branşıyla ilgili bilimsel gelişmeleri takip eden, yöntem teknik ve teknolojilere hakim,,·         ,Hasta memnuniyeti odaklı, ,·         ,İletişim yönü güçlü, pozitif,,·         ,Erkek adaylar için askerlik hizmetlerini tamamlamış,,'Genel Cerrahi Uzmanı’ ,istihdam edilecektir.",GENEL CERRAHİ UZMANI,saglik,,,Medipol Mega Hastaneler Kompleksi,
,,,"Neutec İlaç,'Tıbbi Tanıtım Temsilcisi',İŞ TANIMI",Tıbbi Tanıtım Temsilcisi,saglik,,,Neutec,
,,,"LCWaikiki markası ile Türkiye’nin en değerli markalar sıralamasında “Hazır Giyim ve Mağazacılık” sektöründe 1. sırada yer alan şirketimiz, yaklaşık 10 Milyar $ ciro hedefi, 45 ülkede 42.000’i aşkın çalışanı ve yurtiçi ve yurtdışı olmak üzere toplamda 900’ün üzerinde mağazası ile Türkiye’nin en büyük gruplarından birisi olarak hızla büyüyor.,2023 yılında Avrupa’nın en başarılı üç giyim perakendecisinden biri olma vizyonumuzu gerçekleştirmek üzere hızla büyüyen grubumuzda “,Laboratuvar Test Personeli,” olarak aramıza katılacak ekip arkadaşımızı arıyoruz.,Aranılan Nitelikler:,•Meslek Yüksek Okul mezunu (tekstil, kimya, laboratuvar, ayakkabı, deri bölümlerinden mezun),,•Tekstil test süreçlerinde tecrübeli veya yetiştirilmek üzere istekli, gelişime açık,,•Düzenli, titiz ve dikkatli çalışabilecek,,•Avrupa yakasında ikamet eden,,•Vardiyalı çalışma sistemi (07:45-17:15 / 16:30-00:30) ile çalışabilecek.,İŞ TANIMI,Laboratuvar haslık, fiziksel, boyutsal, yıkama test ve numune kabul bölümlerinde test işlemlerini yapmak.",LABORATUVAR TEST TEKNİSYENİ,saglik,,,Taha Giyim San. Ve Tic. A.Ş.,
(Belirtilmemiştir),Sürekli / Tam zamanlı,,"GENEL NİTELİKLER VE İŞ TANIMI İzmir' de sağlık sektöründe uzman hekim kadrosu, nitelikli personeli ve üstün teknolojik cihazlarla faaliyet gösteren hastanemize, ""Çocuk Hastalıkları Uzmanı"" doktor alımı yapılacaktır. Üniversitelerin ilgili tıp bölümünden mezun, Uzmanlık alanı ile ilgili bilimsel gelişmeleri takip eden, Branşının gerektirdiği vizyona sahip, İnsan ilişkileri ve iletişim becerileri güçlü, güler yüzlü Hasta memnuniyetine önem veren, Tam zamanlı çalışabilecek, İŞ TANIMI Şirketin içinde bulunduğu sektörde hekim sorumluluklarını yerine getirmek. Kendisine bağlı çalışanların iş planlarını yapmak ve koordinasyonu sağlamak. Hasta muayenelerini yapmak ve tedavi planlarını oluşturup periyodik olarak takibini gerçekleştirmek.",Çocuk Sağlığı ve Hastalıkları Uzmanı,saglik,,"Sağlık, Sağlık Kuruluşları, Hastaneler",Smyrna Özel Sağlık Hiz. A.Ş. Özel Ege Yaşam Hastanesi,
