calisma_sekli,departman,egitim,genel_nit_is_tanimi,ilan_baslik,label,sehir,sektor,sirket_adi,tecrube
,,,"Sağlık sektöründeki başarıları ve kaliteli çalışmalarıyla bilinen Özel Aktif Hastanesinde görev yapacak aşağıdaki niteliklere uygun ""Çocuk Sağlığı ve Hastalıkları Uzmanı"" aranmaktadır.,
,
,
,Uzmanlık alanı ile ilgili gelişmeleri yakından takip eden, ,Hasta iletişim yönü güçlü, ,Hasta memnuniyeti odaklı, ,Ekip çalışmasına uyumlu, ,Yalova da ikamet eden/edebilecek olan uzman doktor arayışımız bulunmaktadır.",Çocuk Sağlığı ve Hastalıkları Uzmanı,saglik,,,Gizli Firma,Tecrübeli ya da tecrübesiz adaylar
Uzman,Sürekli / Tam zamanlı,"Yüksek Lisans(Mezun), Üniversite(Mezun)","GENEL NİTELİKLER:,Üniversitelerin Tıp Fakültesi bölümlerinden mezun, ,Mecburi hizmet yükümlülüğü bulunmayan, zorunlu hizmetini tamamlamış, kamu kurumlarında çalışmayan, ,Herhangi bir devlet&vakıf üniversitesinde uzmanlık eğitiminde olmayan, ,Ekip çalışmasına uyumlu, ,Nöbet çalışma şekline uyum sağlayabilecek ve ağırlıklı olarak gece nöbetlerine destek verebilecek,,Tam zamanlı çalışabilecek (ayda 10-12 adet nöbet tutabilecek),İstanbul'da ikamet eden/edebilecek olan,'' Hekim'' aramaktayız.,İŞ TANIMI,Alife Yaşam Boyu Sağlık ve Bakım Merkezi'nde yatan hastaların tedavilerinden sorumlu olmak,,Görev, yetki ve sorumluğundaki süreçleri etkin şekilde yürütmek.",Hekim,saglik,,Sağlık,Acıbadem Mobil Sağlık Hiz. A.Ş.,En az 1 yıl tecrübeli adaylar
Uzman,Sürekli / Tam zamanlı,,"Hastanemizde görev yapmak üzere aşağıda ki niteliklere uygun ,Üroloji/Bevliye Uzmanı, aranmaktadır.,
,Branşı ile ilgili tanı ve tedavi yaklaşımlarında deneyimli,, Uzmanlık alanında bilimsel gelişmeleri takip eden,, Alanında güncel yöntem, teknik ve teknolojilere hakim,, Laparoskopik Cerrahi müdahale bilgi ve becerisi yüksek,, Hasta memnuniyetine önem veren,, İletişimi kuvvetli , Üroloji Uzmanı, aranmaktadır. ",Üroloji / Bevliye Uzmanı,saglik,,Sağlık,Gizli Firma,Tecrübeli ya da tecrübesiz adaylar
(Belirtilmemiştir),Sürekli / Tam zamanlı,,"Hastanemizde görev yapmak üzere aşağıda ki niteliklere uygun, Plastik Cerrahi Uzmanı, aranmaktadır.,Branşı ile ilgili bilimsel gelişmeleri takip eden yöntem , teknik ve teknolojilere hakim,,Ekip çalışmasına yatkın, ,İletişim yönü kuvvetli, ,Branşının gerektirdiği vizyona sahip,,Hasta memnuniyetine önem veren.,Yalova'da ikamet eden ve ya ikamet edebilecek olan ,Plastik Cerrahi Uzmanı ,aranmaktadır.",Plastik Cerrahi Uzmanı,saglik,,Sağlık,Gizli Firma,Tecrübeli ya da tecrübesiz adaylar
(Belirtilmemiştir),Sürekli / Tam zamanlı,," Hastanemizde görev yapmak üzere aşağıdaki niteliklere uygun ,Genel Cerrahi Uzmanı,aranmaktadır. ,Branşı ile ilgili tanı ve tedavi yaklaşımları konusunda deneyimli, ,Mesleği ile ilgili değişim ve gelişimleri takip eden, ,İletişim yönü güçlü, pozitif, ekip çalışmasına uygun, ,Etik değerlere bağlı olan,,Hasta memnuniyet odaklı çalışmayı ilke edinmiş,,İletişimi kuvvetli Genel Cerrahi Uzmanı aranmaktadır.",Genel Cerrahi Uzmanı,saglik,,Sağlık,Gizli Firma,
Uzman,Sürekli / Tam zamanlı,,"Sağlıkta profesyonel yaklaşımı ve ileri teknolojisiyle sektörün çıtasını yükselten, JCI tarafından akredite ,Medistate Kavacık Hastanesi,’nde görevlendirilmek üzere;,Dermatoloji (Deri ve Zührevi Hastalıkları) branşında ‘Uzman Tıp Doktoru’ olan,,Branşı ile ilgili estetik, lazer ve diğer güncel uygulamalarda bilgi ve deneyim sahibi,,Hasta iletişimi kuvvetli, Hasta memnuniyetine önem veren, ,Bilimsel gelişmeleri yakından takip eden, ,Yoğun çalışma temposuna ayak uydurabilecek, ,'' Dermatoloji  Uzmanı'', aranmaktadır. ",Dermatoloji Uzmanı,saglik,,Sağlık,Medistate Kavacık Hastanesi,
Eleman,Sürekli / Tam zamanlı,,"İstanbul Kartal'da yeni açılacak eczanemizde görevlendirilecek, tecrübeli çalışma arkadaşları alınacaktır. , - Eczanedeki tüm işlerde görev alacak ve tam zamanlı çalışacak,, - SGK ve reçete işlemleri yapacak,, - Satış gerçekleştirerek müşteri memnuniyeti sağlayabilecek, , - Sempatik, güler yüzlü, müşteri ilişkilerinde başarılı,, - Titiz, dikkatli, işini seven,, - Ekip çalışmasına yatkın, genç, dinamik,, - Tercihen Kartal ve çevresinde ikamet eden.",Eczane Elemanı,saglik,,Sağlık,May Eczane,
,,,"Meslek lisesi veya meslek yüksek okullarının tekstil, kimya, boya bölümlerinden mezun,,Alanında en az 5 yıl tecrübeli,,Reçete yazabilen,,Spektrometre kullanabilen,",Laboratuvar Elemanı,saglik,,,Botaş Nehir Tekstil Boya Emprime San. ve Tic. A.Ş.,
,,,"Özel hastane çalışma deneyimine sahip,,Hasta memnuniyeti odaklı çalışmayı ilke edinmiş,,İletişim yeteneği güçlü, pozitif,,Branşı ile ilgili bilimsel gelişmeleri takip eden ve uygulayan,,Branşının gerektirdiği vizyona sahip,,Tam zamanlı çalışabilecek,,Antalya/ Kumluca' da ikamet eden ya da edebilecek,RADYOLOJİ UZMANI aramaktayız.",Radyoloji Uzmanı,saglik,,,ÖZEL MEDİKUM HASTANESİ,
,,,"GENEL NİTELİKLER ,Elithair Transplant Ultra VIP Saç Ekim firması 2009'dan beri sektörde öncü olup  ağırlıklı olarak Avrupalı hastalara hizmet vermektedir. ,Bahçeşehir bölgesinde yerleşik olan İstinye Üniversite Liv hastanesinde faaliyet gösteriyor,Üniversitelerin Hemşirelik bölümlerinden mezun,,Sağlık meslek yüksek okul (hemşire çıkışlı),,En az 4 yıl servis/cerrahi servis deneyimi olan,,Ekip çalışmasına yatkın,,Tam zamanlı çalışabilecek,,Dinamik veya zor çalışma ortamında kariyer hedefleyen,,Hasta güvenliği ve memnuniyeti odaklı çalışan,,Etik ve sonuç odaklı çalışan,,İletişimi güçlü, insan ilişkilerinde başarılı,,Erkek adaylar için askerlik hizmetini tamamlamış,,Not:  ATT, PARAMEDİK, LABORANT,,,ANESTEZİ TEKNİKLERİ, veya BİYOLOG başvuruları değerlendirilmeyecektir.",HEMŞİRE ( SAÇ EKİMİ),saglik,,,United Medikal ve sağlık hizmetleri LTD. Şti,
,,,"-Mühendislik fakültesi mezunu,,-En fazla 3 yıl deneyime sahip,,-En az orta derecede ingilizce konuşup yazabilen, ,-En fazla 30 yaşında,,-Eskişehir ve Bozüyükte ikamet edebilecek,,-C Sınıfı İş Güvenliği Uzmanlık belgesine sahip,,-Çözüm odaklı ve kriz anında karar verebilen iş güvenliği uzmanı aramaktayız.,İŞ TANIMI,TORRECİD TÜRKİYE,Torrecid 1963 yılında kurulmuş Seramik ve Cam üretim sektörlerine ürün, hizmet, çözümler ve gelecek trendleri sağlayan çokuluslu iş grubudur.,Torrecid Grup ana merkezi İspanya-Alcora Castellon da yer almakta olup, 28 ülkede şubesi bulunmaktadır. Bunun yanısıra 130'dan fazla ülkeye de hizmet vermektedir.,Torrecid stratejisi yeni çözümler ve gelecek avantajları yaratmak için innovasyon ve maksimum ilave değer temeline dayanmaktadır.,Torrecid Grup bünyesinde yaklaşık 4500 çalışanı bulunmaktadır.,İş güvenliği uzmanı iş tanımı:,-İş Sağlığı ve Güvenliği ile ilgili yasal yükümlülüklerin takip, plan, prosedür ve talimatların hazırlanması ve süreçlerin iyileştirilmesi,,-İSG ile ilgili eğitimleri planlamak ve uygulamak,,-Tehlike tanımlama, risk değerlendirme çalışmalarının yürütülmesi, risk azaltma çalışmalarının yapılması,,-Acil durum eylem planlarını hazırlamak ve uygulamaları takip etmek.",İş Güvenliği Uzmanı,saglik,,,TORRECID SERAMİK FRİT VE GLAZÜR SAN VE TİC LTD ŞTİ,
Uzman,Sürekli / Tam zamanlı,,"ÇSGB onaylı İŞYERİ HEKİMLİĞİ sertifikasına sahip, ,İSG mevzuat, yönetmelik ve saha uygulamalarına hakim, ,TAM ZAMANLI yada YARI ZAMANLI, ,MS Office programlarına kullanabilen, ,Ekip çalışmasına yatkın ve analitik düşünebilen, ,Erkek adaylar için Askerlik hizmetini tamamlamış, ,ESKİŞEHİR'de ikamet eden veya edebilecek olan, ,ESKİŞEHİR ve çevre illerinde ikamet edecek veya edebilecek, ,Aktif olarak araç kullanabilen, ,Seyahat engeli olmayan. ,İŞ TANIMI,İşyerlerinde personellerin bütün ilk kademe sağlık hizmetlerinin yürütülmesi,,ISG faaliyetlerine katılım sağlanması, ,Periyodik muayenelerin yapılması ",İşyeri Hekimi,saglik,,İş Sağlığı ve Güvenliği,İKİ EYLÜL ORTAK SAĞLIK VE GÜVENLİK BİRİMİ,En çok 10 yıl tecrübeli adaylar
,,,"Cildiye(Dermatoloji) branşında Uzman,,Branşıyla ilgili bilimsel gelişmeleri takip eden,,
Alanındaki tanı ve tedavi yaklaşımları konusunda güncel yöntem, teknik ve teknolojilere hakim,,
Branşının gerektirdiği vizyona sahip,,
Hasta memnuniyeti odaklı,,
İletişim yönü güçlü,,
,Kartal Özel Vera Hastanesi'nde tam zamanlı çalışabilecek Cildiye Uzmanı aranmaktadır",Cildiye Uzmanı,saglik,,,ÖZEL VERA HASTANESİ/KARTAL,
(Belirtilmemiştir),Sürekli / Tam zamanlı,,"Hizmet verdiğimiz bir ilaç firmasında görevlendirilmek üzere;,Hekimin yanında hasta veri girişi yapabilecek ve klinik takibi yapabilecek ,Eğitim Hemşiresi, aramaktayız.,Eğitim kurumlarının hemşirelik-ebelik bölümlerinden mezun,,Hemşirelik mesleğinde deneyimli, ,Tercihen eğitim hemşiresi olarak en az 3 yıl deneyimi olan, ,Tercihen lisans mezunu ve hasta eğitimi projelerinde görev almış, ,Diksiyonu düzgün, MS Office programlarını etkin şekilde kullanan, ,İletişim yetkinliklerini etkin kullanan,, Dışa dönük bir kişilik yapısı olan ve öğrenmeye açık prezantabl,, Aktif araç kullanabilen",Eğitim Hemşiresi,saglik,,"Sağlık, Hizmet ",Platform Sağlık Hizmetleri ve Danışmanlık Organizasyon A.Ş.,
Sürekli / Tam zamanlı,Sağlık,,"ÖZEL BİLGİ HASTANESİ', ,Radyoloji branşında 'Uzman Tıp Doktoru' olan ,Branşıyla ilgili bilimsel gelişmeleri takip eden, yöntem teknik ve teknolojilere hakim,Ankara'da ikamet eden / edebilecek ,Tam zamanlı çalışabilecek ,Hasta memnuniyeti odaklı, pozitif, iletişim yönü güçlü,aktif ,Erkek adaylar için askerlik hizmetini tamamlamış ,Ortopedi ve Travmatoloji Uzmanı?",Ortopedi ve Travmatoloji Uzmanı,saglik,Ankara,Sağlık,BATIKENT BİLGİ HASTANESİ,
Sürekli / Tam zamanlı,Mühendislik,"Ön Lisans(Mezun), Üniversite(Mezun)","
,Nenek-Şefaatli Arası Hat Kesimi ile Tüpraş İltisak Hattı Elektrifikasyon Yapım İşi Projesi Kapsamında İstihdam edilecek,,
,Üniversitelerin 2 yıllık İş Sağlığı ve Güvenliği bölümünden mezun,,Tercihen C Sınıfı İş Güvenliği Uzmanlığı sertifikasına sahip,,Tüm çalışanların ve iş makinelerinin İSG evrakı gereksinimlerini takip edecek,,6331 sayılı Kanun esasları ve diğer İSG Mevzuatı hükümlerine hâkim,,Eğitim verebilecek,, ,Demiryolu ortamında tüm iş süreçlerini izleyerek gerekli iyileştirme faaliyetlerini programlayıp uygulayacak,,Tercihen kanal kazısı, kablo çekimi vb. işlerinde deneyim sahibi,,Tercihen B sınıfı sürücü belgesi olan ve aktif araç kullanabilen,,Tercihen Kırıkkale de ikamet eden,,İŞ TANIMI,
,Şirketimize bağlı şantiyelerde İş Sağlığı ve Güvenliği politikaları ve prosedürleri hakkında planlanma, uygulama yapılması ve sürdürebilirlik sağlanması,,Risk Analizlerinin yapılması,, ,Acil Eylem Planlarının hazırlanması ve tatbikatların yapılması,,İSG eğitim organizasyonlarının yapılması ve uygulanması,,İSG ile ilgili denetlemelerin yapılması ve raporlanması,",İş Güvenliği Teknikeri,saglik,Kırıkkale,Enerji,EMRE RAY ENERJİ,2 - 3 yıl tecrübeli adaylar
,,,"İŞ TANIMI,Firmamız bünyesinde istihdam edilerek ;,Çevre Bakanlığı Yetkisinde Çalışan Çevre Laboratuvarımızda; ,Analiz ve Saha Ölçümlerinde(Tercihen Çevre Bakanlığı'ndan alınmış Emisyon ve Atıksu Yetki Belgeli Olması),, ,Kalite biriminde görevlendirilmek, ,üzere; çalışma arkadaşları alınacaktır.  ,- ,Tercihen ,KOCAELİ’DE İkamet Eden,,- Çevre ve Şehircilik Bakanlığı'ndan alınmış Emisyon ve Atıksu Yetki Belgesi Olan,,-Pozisyon  Kapsamında, ,Kimyager, ,Kimya Teknikeri,, ,Su Ürünleri Mühendisi, Çevre Mühendisi, Kimya Mühendisi, Tekstil Mühendisi vb. meslek grubuna giren adayların başvurusu kabul edilecektir., · ,Çevre Görevlisi Belgesine Sahip,, , · ,ISO 9001 ve TS EN ISO 17025 Kalite Sistemleri Konusunda Eğitim ve Deneyime Sahip,,, · Erkek Adaylar İçin ,Yükseklik Korkusu Olmayan,, , · Erkek Adaylar için ,Saha Çalışmasına Yatkın,, , · Tercihen ,en az 2 yıl Benzer İş Deneyimi Olan,, , · ,Aktif araç kullanabilen,,, · Diksiyonu düzgün, , · ,Seyahat engeli olmayan, , · Tercihen İngilizce Bilen, , ·, ,Erkek Adaylar için askerlik sorunu olmayan,. , · ,Özellikle kısa süreli çalışma planı yapan ve Kocaeli bölgesinde ikamet etmeyen adayların başvuru yapmaması rica olunur. ",ÇEVRE LABORATUVARINDA ÇALIŞACAK DENEYİMLİ MÜHENDİS,saglik,,,Temsat Mühendislik Su Arıtma Danışmanlık ve İnşaa,
Sürekli / Tam zamanlı,Sağlık,,"MLPCARE, 17 ilde, 6 coğrafi bölgede 31 hastanesi ve 19 bin’e yakın çalışanı ile sağlık sektörüne yön veren en büyük sağlık kurumudur. Çeyrek asır önce Medical Park ile sağlık yolculuğuna başlayan grup, Liv Hospital ve VM Medical Park hastane markaları ile hizmet veriyor. Sağlıkta uluslararası standartları, uzman hekim kadrosu, hasta odaklı üstün hizmet anlayışını benimseyen MLPCARE Sağlık Grubu, ,Joint Commission International (JCI), akreditasyonu belgesine sahip hastaneleriyle Türkiye’nin 4 bir yanında yeni yatırımlarla yaygınlığını artırmaya devam ediyor. MLPCARE sağlık grubu, Herkes İçin Sağlık, Hayat Güzeldir ve Değer Katan Hizmet felsefesiyle hizmet veren hastaneleriyle sağlık yolculuğuna hız kesmeden devam ediyor.,İŞ TANIMI,WM Medical Park Pendik  Hastanesi,'nde görevlendirilmek üzere;,Tercihen en az ön lisans mezunu, ,Hasta kabul/vezne pozisyonunda en az 1 yıl deneyimli, ,Hasta kayıt, kabul, faturalandırma süreçlerinde tecrübe sahibi, ,Anlaşmalı Kurumlar ve özel sağlık sigortalı hasta süreçlerine hakim, ,Planlama ve organizasyon yeteneğine sahip, ,Analitik ve sonuç odaklı, iletişim yeteneği kuvvetli, ekip motivasyonunu sağlayacak, ikna kabiliyeti yüksek,,MS Office uygulamalarına hakim, ,Esnek çalışma saatlerine uyum sağlayacak.,'''Ayaktan Misafir Hizmetleri Yetkilisi '' ,arayışımız mevcuttur.",Hasta Kayıt Yetkilisi,saglik,"İstanbul(Avr.), İstanbul(Asya)",Sağlık,MLP Sağlık Hizmetleri A.Ş.,
,,,"Üniversitelerin Diyaliz Teknikerliği bölümlerinden mezun ,İnsan ilişkilerinde başarılı ,Sorumluluk sahibi, dikkatli, titiz ,Ekip çalışmasına yatkın ,Erkek adaylar için askerlikle ilişiği olmayan ,Tercihen en az 2 yıl tecrübeli,Kayseri' de ikamet eden,İŞ TANIMI,Uzman hekim önderliğinde, tedavi protokollerine uygun bir şekilde hemodiyaliz tedavilerini gerçekleştirmek,Tedavinin kaliteli bir şekilde yerine getirilmesini sağlamak amacıyla, diyaliz öncesinde ve diyaliz programları sırasında, hastanın tüm bakımını üstlenmek.",Diyaliz Teknikeri,saglik,,,Dmed Diyaliz Hizmetleri A.Ş.,
Sürekli / Tam zamanlı,Sağlık,,"·,         ,Hemşire ve Estetisyen Cilt Bakımı Diploması olan veya Tecrübeli Satış Uzmanı.,·,         ,Lazer Epilasyon, (Alaxandrite ve Ütüleme) bölgesel zayıflama, cilt bakımı uygulamalarında ve sağlık sektöründe çalışmış en az 2 yıl deneyimli,,·,         ,Dış görünümüne özen gösteren, bakımlı, prezantabl,,·,         ,İnsan ilişkilerinde başarılı, iletişim yeteneği güçlü,,·,         ,Diksiyonu düzgün,,·,         ,Öğrenmeye açık ve sorumluluk sahibi,,·,         ,Ekip çalışmasına yatkın,,·,         ,Hasta memnuniyetine önem veren,,·,         ,Satış konusunda tecrübesi olan ,,·,         ,Branşı ile ilgili gelişme ve yenilikleri takip eden,,·,         , İletişim becerileri kuvvetli, ikna kabiliyeti yüksek, ,         ,  ""Estetisyen veya Satış Uzmanı "", çalışma arkadaşları aramaktayız...","Estetisyen, Bayan Hemşire ve Satış Uzmanı",saglik,,"Bakım, Diyet ve Güzellik Merkezleri",Özel EsmerLife Polikliniği,2 - 20 yıl tecrübeli adaylar
,,,"Tıbbi Dokümantasyon ve Sekreterlik önlisans mezunu ve tercihen en az 1 yıl deneyimli,,Microsoft Office programlarını kullanabilen, ,Hasta ve iletişim odaklı, ,Diğer sağlık çalışanları ile birlikte çalışmaktan ve hastalara yardımcı olmaktan mutluluk duyan,,Analitik düşünen, ,Tıbbi Sekreter olarak görev yapacak çalışma arkadaşları arıyoruz.,İŞ TANIMI,Tıbbi kayıtların hastanın süreci doğrultusunda oluşturulmasında rol almak, ,Hastalara ve ilgili resmi kurumlara tıbbi bilgi ve belgeleri iletmek, ,Tıbbi kayıtları fiziksel ve dijital olarak arşivlemek, ,Tıbbi raporları terminoloji kuralları çerçevesinde yazmak, ,Tıbbi istatistikleri düzenlemek, yasal bildirimleri yapmak, ,Hekim, hemşire ve diğer sağlık çalışanları ile birlikte tüm tıbbi kayıt süreçlerinde işbirliği içerisinde çalışmak",Tıbbi Sekreter ( Genel Yoğun Bakım ),saglik,,,Hastane Derindere,
Sürekli / Tam zamanlı,Satış,"Ön Lisans(Mezun), Üniversite(Öğrenci), Üniversite(Mezun), Yüksek Lisans(Öğrenci), Yüksek Lisans(Mezun), Doktora(Öğrenci), Doktora(Mezun)","* Üniversite veya Yüksekokul mezunu,,* Tıbbi tanıtım alanında maximum 3 yıl satış tecrübesine sahip,* Tercihen daha önce Kadın Doğum tedavi alanında tecrübeli,* 35 yaşını aşmamış.,* Ekip çalışmasına yatkın,* Yüksek iletişim becerisine sahip,* Sayısal analiz yapabilen / Sonuç odaklı,* B sınıfı sürücü ehliyetine sahip ve aktif güvenli araç kullanabilen,* Seyahat engeli olmayan,* MS Ofis uygulamalarını etkin şekilde kullanabilen,*Askerlik hizmetini tamamlamış (Erkek adaylar için),*Mutlaka aktif ÜTE sertifikası bulunan (Tüm adaylar için),İŞ TANIMI",Ürün Tanıtım Temsilcileri,saglik,"Hatay, İstanbul(Avr.), İstanbul(Asya)",İlaç Sanayi,Itf İlaç Sanayi Ve Tic.Ltd.Şti.,1 - 5 yıl tecrübeli adaylar
Sürekli / Tam zamanlı,Sağlık,,"Türkiye’de modern ve güvenilir sağlık hizmeti sunan, sağlıkta yeniliklerin öncüsü Grubumuz; ISO9001 belgesinin yanı sıra, Alman TÜV ve American Joint Commission International akreditasyon belgelerine sahip olup, Türkiye’de, Ortadoğu’da, Kuzey Afrika, Doğu Avrupa ve Orta Asya’da birçok branşta referans merkezi konumdadır. Çeyrek asrı aşkın deneyimiyle pek çok alanda ve branşta hizmet vererek yeniliklerin öncüsü olmaya devam eden Grup Florence Nightingale olarak,En az lise mezunu,,Eczane teknikerliği sertifikasına sahip,,İlaç hazırlamayı bilen,,Hastanelerin eczane bölümünde en az 2 yıllık deneyimi olan,,Vardiyalı çalışabilecek,,Ekip çalışmasına yatkın,Erkek adaylar için askerlik görevini tamamlamış,Avrupa yakasında ikamet eden,',Eczane Teknikeri,',aramaktayız.",ECZANE TEKNİKERİ,saglik,,Hastaneler,Grup Florence Nightingale Hastaneleri,1 - 3 yıl tecrübeli adaylar
,,,"Bağdat Caddesi'nde kurulu olan tıp merkezimiz için,,Eğitim ve Tecrübe ,· Lise veya Üniversitelerin Tıbbi Görüntüleme Teknikerliği bölümünden mezun,, · Yetiştirilmek üzere, ,· PET-CT ve SPECT-CT cihazları kullanımı konusunda öğrenmeye ilgili ve meraklı, , Kişisel Özellikler;, · Analitik düşünebilen zaman yönetimi ve planlama yeteneği güçlü, ,· Sorumluluk bilinci yüksek, ,· Değişim ve gelişmelere süratle uyum sağlayan, kendisini sürekli geliştiren,, · Dinamik bir çalışma ortamının gerektirdiği temel esnekliğe sahip, ,· Güleryüzlü ve hizmet kalitesine önem veren, , SİSTEME İNANAN VE SİSTEMLİ ÇALIŞMAYI İLKE EDİNMİŞ TAKIM ARKADAŞLARI ARIYORUZ.",Nükleer Tıp Teknikeri,saglik,,,Can Grup - Özel Lifemed Tıp Merkezi - Can Medikal Hizmetler A.Ş.,
Sürekli / Tam zamanlı,Hizmet,,"Nureste Estetik ve Güzellik Merkezi olarak Fatih ve Kavacık şubelerimizde görevlendirilmek üzere, ''Uzman Estetisyenler'', aranmaktadır; ,En az lise mezunu, tercihen lisans düzeyinde estetisyenlik eğitimi almış, ,Tercihen uzman estetisyen veya estetisyenlik belgesi sahibi, ,Branşı ile ilgili özel eğitimler ve güncel uygulamalar ile kendisini sürekli geliştiren ve yenilikleri takip eden, ,Cilt Bakımı, Lazer epilasyon uygulamalarında en az 2 yıl deneyimli, ,Bölgesel incelme cihazlarını (Soğuk Lipoliz, G5 Vibromasaj, Pasif Jimnastik, Lenf Drenaj) aktif olarak kullanabilen, ,Tercihen LPG Endermologie Cellu M6 Alliance tecrübesi olan, ,İkna kabiliyeti yüksek,,İletişim yeteneği güçlü, sunum becerisi gelişmiş, diksiyonu düzgün, ,Gelişime açık ve sorumluluk sahibi, ,Dış görünümüne özen gösteren, bakımlı, prezentabl, ,Ekip çalışmasına yatkın,,Özveri ve azimli çalışmayı seven ve alanında kariyer edinmek isteyen.",Estetisyen,saglik,,"Bakım, Diyet ve Güzellik Merkezleri",Nureste Estetik ve Güzellik,Tecrübeli ya da tecrübesiz adaylar
,,,"Kadrolu tam zamanlı veya yarı zamanlı olarak çalışabilecek,,Gece vardiyasında çalışabilecek,,Kadın Hastalıkları ve Doğum alanında uzmanlığını tamamlamış,,Alanı ile ilgili en az 3 yıl tecrübeye sahip,,Branşı ile ilgili bilimsel gelişmeleri takip eden,,Alanındaki tanı, tedavi ve yaklaşımları konusunda güncel yöntem, teknik ve teknolojilere hakim,,Etik değerlere bağlı branşın gerektirdiği vizyona sahip,,Dinamik, iletişim yeteneği güçlü, pozitif,,Sosyal ve insani değerleri yüksek,,Hasta memnuniyeti odaklı çalışmayı ilke edinmiş,,Dünyanın köklü ve saygın akreditasyon kurumu olan JCI tarafından hizmet kalitesi belgelenen, Etik ilkelerden asla ödün vermeden seçkin kadrosu ile bilimsel ve teknolojik gelişmeleri takip eden; uluslararası standartlarda sağlık hizmeti sunan ve hastalarımıza hak ettikleri kaliteli ve güvenilir sağlık hizmetleri veren ,Hisar Hospital Intercontinental, bünyesinde görevlendirilmek üzere;,"" ,Nöbetçi Kadın Hastalıkları ve Doğum Uzmanı, "" aramaktayız.",Gece Kadın Hastalıkları ve Doğum Uzmanı,saglik,,,Hisar Hospital Intercontinental,
,,,"Kadrolu tam zamanlı veya yarı zamanlı olarak çalışabilecek,,Gece vardiyasında çalışabilecek,,Çocuk Sağlığı ve Hastalıkları alanında uzmanlığını tamamlamış,,Alanı ile ilgili en az 3 yıl tecrübeye sahip,,Branşı ile ilgili bilimsel gelişmeleri takip eden,,Alanındaki tanı, tedavi ve yaklaşımları konusunda güncel yöntem, teknik ve teknolojilere hakim,,Etik değerlere bağlı branşın gerektirdiği vizyona sahip,,Dinamik, iletişim yeteneği güçlü, pozitif,,Sosyal ve insani değerleri yüksek,,Hasta memnuniyeti odaklı çalışmayı ilke edinmiş,,Dünyanın köklü ve saygın akreditasyon kurumu olan JCI tarafından hizmet kalitesi belgelenen, Etik ilkelerden asla ödün vermeden seçkin kadrosu ile bilimsel ve teknolojik gelişmeleri takip eden; uluslararası standartlarda sağlık hizmeti sunan ve hastalarımıza hak ettikleri kaliteli ve güvenilir sağlık hizmetleri veren ,Hisar Hospital Intercontinental, bünyesinde görevlendirilmek üzere;,"" ,Nöbetçi Çocuk Sağlığı ve Hastalıkları Uzmanı,"" ,aramaktayız.",Gece Çocuk Sağlığı ve Hastalıkları Uzmanı,saglik,,,Hisar Hospital Intercontinental,
Sürekli / Tam zamanlı,Sağlık,,"Hastanemi·z bünyesi·nde tam zamanli  çalışmak üzere ; ,Göğüs hastaliklari uzmani (doktor) arayişimiz mevcuttur., I·lgi·lenen heki·mler müracaatta bulunabi·li·r.,Branşında Uzmanlığını Tamamlamış,,Aktif Çalışabilen,,Enerjik,Çalışkan,İletişimi Güçlü,,Ekip Çalışmasına Uygun,,Tanı,Tedavi ve Yaklaşımlar Konusunda Bilgi ve Deneyim Sahibi,,Tam Zamanlı,",Göğüs Hastalıkları Uzmanı,saglik,,Sağlık,ÖZEL İLGİ HASTANESİ,
Sürekli / Tam zamanlı,Sağlık,,"Hastanemi·z bünyesi·nde tam zamanli  çalışmak üzere ; ,Kardi·yoloji· uzmani (doktor) arayişimiz mevcuttur. I·lgi·lenen Heki·mler müracaatta bulunabi·li·r., ,Branşında Uzmanlığını Tamamlamış,,Aktif Çalışabilen,,Enerjik,Çalışkan,İletişimi Güçlü,,Ekip Çalışmasına Uygun,,Tanı,Tedavi ve Yaklaşımlar Konusunda Bilgi ve Deneyim Sahibi,,Tam Zamanlı,",Kardiyoloji Uzmanı,saglik,,Sağlık,ÖZEL İLGİ HASTANESİ,Tecrübeli ya da tecrübesiz adaylar
,,,"Üniversitelerin ilgili bölümlerinden mezun,,Alanında en az 1 yıl benzer deneyime sahip,,Tercihen iyi seviyede İngilizce bilen (yeterlilik belgesi bulunan),,MS Office programlarını etkin kullanabilen,,İletişim, organizasyon, planlama ve koordinasyon yeteneği gelişmiş, ekip çalışmasına yatkın,Üniversitemizin Bakırköy yerleşkesinde görev almaya uygun.,İŞ TANIMI,Kurumumuzun verdiği hizmetlerinden faydalanmak üzere gelen hastalara gerekli bilgileri aktaracak,,Hastaların kabul işlemleri için gerekli hazırlıkları tamamlayacak,,Hizmetlerimizden faydalanan/faydalanacak hastaların ödemesini alacak ve faturasını kesecek,,Hastanın ödemesiyle ilgili evrakların eksiksiz olduğunu kontrol ederek teslim edecek.",Hasta Kabul Görevlisi (İngilizce Bilen),saglik,,,Altınbaş Üniversitesi,Tecrübeli ya da tecrübesiz adaylar
