calisma_sekli,departman,egitim,genel_nit_is_tanimi,ilan_baslik,label,sehir,sektor,sirket_adi,tecrube
,,,"JCI (Joint Commission International) akreditasyon belgesine sahip olan ,Özel Medicabil Hastanemizde, görevlendirilmek üzere;,•             En az lise mezunu (tercihen sağlık meslek lisesi ve/veya hemşirelik fakültesi mezunu),,•             Anadili Arapça veya ileri düzeyde Arapça okur yazar olan,,•             Anadili Arapça olmayanlar için Türkçe dil düzeyini gösterir B2 seviyesinde belgeye sahip olan,,•             MS Office Programlarını iyi derecede kullanabilen,,•             Bursada ikamet eden,,•             Erkek adaylar için askerliğini tamamlamış,,•             Sosyal medya ilişkileri güçlü,,•             İletişim ve ikna becerisi yüksek,,•             Güleryüzlü, pozitif ve çözüm odaklı,,•             Dış görünüşüne ve kişisel bakımına önem veren,,•             Sözlü ve yazılı ifade yeteneği gelişmiş,,•             Sorumluluk sahibi ve temsil yeteneği gelişmiş,,•             Hastaları ziyaret ederek iletişim kurabilen,,•             Tam zamanlı çalışabilecek ve esnek çalışma saatlerine uyum gösterebilecek,,'Uluslararası  Hasta İlişkileri Görevlisi', arıyoruz., ,İŞ TANIMI,•             Yurt dışından gelen hastaları organize ederek  tedavi sürecini takip etmek,,•             Bağlı olduğu Uluslararası Sağlık Turizmi Birimi Sorumlusu`ndan destek alarak Uluslararası Hasta Hizmetleri süreçlerini yürütmek,,•             Yurtdışı hastalara ulaşarak tanıtım ve bilgilendirme yapmak,,•             Sağlık Turizmi çerçevesinde transferi gerçekleşen misafirlerimizi karşılamak, ağırlamak ve memnun şekilde uğurlanmasına destek olmak,,•             Tedavi sonrası takiplerinin sağlanması, hastalar ile iletişimin devam ettirilmesi, gerektiğinde hasta ve doktor arası iletişimi sağlamak,,•             Hastanenin tanıtım ve bilgilendirme konularında aktif görev almak,,•             Yabancı sigorta süreçlerinde acentelerle koordine çalışmak,,•             Hasta sorunlarına çözüm bularak, hasta memnuniyetini arttırmaya yönelik çalışmalarda yer almak,,•             Hastalar ile tüm yazılı ve sözlü iletişimi sağlamak,,•             Hasta akışı sağlanması için saha çalışmalarına destek vermek.",Uluslararası Hasta İlişkileri Uzmanı,saglik,,,Özel Medicabil Hastanesi,
,,,"  JCI (Joint Commission International) akreditasyon belgesine sahip olan ,Özel Medicabil Hastanemizde,  Omurga Cerrahi merkezinde görevlendirilmek üzere;,Branşı ile ilgili bilimsel gelişmeleri takip eden,,Yöntem, teknik ve teknolojilere hakim,,İletişim yeteneği yüksek,,Ekip çalışmasına yatkın,,Hasta memnuniyetine önem veren,,Erkek adaylar için askerliğini tamamlamış,,Tam zamanlı çalışabilecek,,    'Beyin ve Sinir Cerrahı' arıyoruz",Beyin ve Sinir Cerrahı,saglik,,,Özel Medicabil Hastanesi,
,,,"  JCI (Joint Commission International) akreditasyon belgesine sahip olan ,Özel Medicabil Hastanemizde,  Omurga Cerrahi merkezinde görevlendirilmek üzere;,Branşı ile ilgili bilimsel gelişmeleri takip eden,,Yöntem, teknik ve teknolojilere hakim,,İletişim yeteneği yüksek,,Ekip çalışmasına yatkın,,Hasta memnuniyetine önem veren,,Erkek adaylar için askerliğini tamamlamış,,Tam zamanlı çalışabilecek,,    'Ortopedi ve Travmatoloji Uzmanı' arıyoruz",Ortopedi ve Travmatoloji Uzmanı,saglik,,,Özel Medicabil Hastanesi,
Sürekli / Tam zamanlı,Sağlık,,"Medicalpark Silivri Hastanesinde değerlendirmek üzere; ""Hemşire"" arayışımız bulunmaktadır.,GENEL ÖZELLİKLER,Üniversitelerin Hemşirelik Bölümlerinden ve/veya Sağlık Meslek Liselerinin Hemşirelik bölümlerinden mezun,,Kendi alanında en az 2 yıl deneyimi olan,,Branşı ile ilgili gelişme ve yenilikleri takip eden,,Olumlu iletişim becerilerine sahip, kendini iyi ifade edebilen, sözlü ve yazılı iletişimi güçlü,,Organizasyon ve koordinasyon becerisi gelişmiş, ekip çalışmasına yatkın,,Sorun çözme becerisi gelişmiş olan,,Hasta memnuniyetine önem veren,,""Hemşire” ,adaylarını ailemize katılmaya davet ediyoruz.",Hemşire,saglik,İstanbul(Avr.)(Silivri),Sağlık,MLP Sağlık Hizmetleri A.Ş.,
Sürekli / Tam zamanlı,Sağlık,"Üniversite(Mezun), Yüksek Lisans(Öğrenci), Yüksek Lisans(Mezun), Doktora(Öğrenci), Doktora(Mezun)","Özel Batman Dünya Hastanesi’nde görevlendirmek üzere,Kulak Burun Boğaz alanında ihtisas yapmış,,Branşıyla ilgili bilimsel gelişmeleri yakından takip eden, ,Alanındaki tanı ve tedavi yaklaşımları konusunda güncel yöntem, teknik ve teknolojilere hâkim, ,Hasta memnuniyetini ilke edinmiş,,Ekip çalışmasına uyumlu,,'Kulak Burun Boğaz Uzman Doktoru'  ,aramaktayız.,İŞ TANIMI,Alanındaki tanı ve tedavi yaklaşımları konusunda güncel yöntem, teknik ve teknolojilere hâkim ,'Kulak Burun Boğaz Uzman Doktoru,' ,alınacaktır.",KBB (Kulak Burun Boğaz) Uzmanı,saglik,Batman(Merkez),Sağlık Kuruluşları,BATMAN ÇAĞ SAĞLIK HİZMETLERİ VE TİCARET A.Ş.,Tecrübeli ya da tecrübesiz adaylar
Sürekli / Tam zamanlı,Sağlık,,"Hastanemiz Bünyesinde Çalışmak Üzere Tam Zamanlı Bayan ''Kadın Hastalıkları Ve Doğum Uzmanı'' Arayışımız Mevcuttur.,Aktif Çalışabilen,,Doğum Ve Ameliyatlara Katılabilen,,Enerjik,,Çalışkan,,,Ekip Çalışmasına  Uygun.",Kadın Doğum Uzmanı,saglik,İstanbul(Avr.)(Güngören),Sağlık,ÖZEL İLGİ HASTANESİ,Tecrübeli ya da tecrübesiz adaylar
,,,"GENEL NİTELİKLER VE İŞ TANIMI,Şirketimizin Gebze Fabrikası Kalite Bölümü'nde görev almak üzere aşağıdaki özelliklere sahip,""3D Ölçüm CMM ve Laboratuvar Teknisyeni"" aramaktayız:, ,·,         ,PC- DMIS programını kullanan, ,·,         ,En az Meslek Lisesi veya Meslek Yüksek Okullarının ilgili bölümlerinden mezun,,·,         ,Tercihen; Plastik malzeme testleri (çekme, renk, yüzey, yoğunluk vb) plastik malzeme test,·,         , yöntemlerinde bilgi ve tecrübe sahibi, ,·,         ,Tercihen üretim ve muayene süreçleri hakkında bilgi ve tecrübe sahibi olmak, ,·,         ,Muayene ve ölçüm konusunda en az 3 yıl tecrübeye sahip olmak ,·,         ,CMM teknisyeni olarak en az 3 yıllık tecrübeye sahip olmak. ,·,         ,Teknik resim, standart ve mühendislik dokümanlarını anlamak ve yorumlayabilmek, ,·,         ,Ölçüm aletleri ve test ekipmanlarını ürün doğrulaması için etkin bir şekilde kullanabilmek, ,·,         ,MS Office programlarını etkin bir şekilde kullanabilmek, ,·,         ,IATF 16949 Otomotv Kalite Sistemi konusunda bilgisi olan,·,         ,Görme yetisinde herhangi bir engeli olmayan,,·,         ,Erkek adaylar için askerlik hizmetini tamamlamış olmak,,·,         ,İstanbul Asya yakası, Gebze, Darıca bölgesinde ikamet eden, , ,İŞ TANIMI,·,         ,Otomotiv sektörüne yönelik Plastik parça imalatı yapan firmamızda Laboratuvar bölümünde çalışacak,·,         ,Üretimi yapılan parçaların 3D ölçümlerini yapmak,,·,         ,Parçaların yıllık olarak üretim hattı kontrollerini ve performans testlerini yapmak,,·,         ,Parçaların yıllık olarak MSA çalışmalarını yapmak,,·,         ,Bakım planına göre sorumlu olduğu cihazların bakımlarını yapmak,,·,         ,Kalibrasyon planına göre kullandığı cihazların kalibrasyonunun yapılmasını sağlamak,·,         ,Yönetim sistemi içerisinde tanımlanmış diğer görev ve sorumlulukları yerine getirmek,·,         ,Belirtilen görev ve sorumlulukları ile ilgili olarak gerekli bilgileri, raporları, gelişmeleri ve ortaya çıkan sorunları yöneticisine raporlamak.",3D Ölçüm CMM ve Laboratuvar Teknisyeni,saglik,,,Plascam Plastik Oto Cam Sanayi ve Tic. A.Ş.,
Sürekli / Tam zamanlı,Sağlık,,"Sağlık Meslek Lisesi, Meslek Yüksek Okul veya Lisans mezunu, ,En az 3 yıl Ameliyathane deneyimi olan, ,Branşı ile ilgili gelişme ve yenilikleri takip eden, ,Ekip çalışmasına yatkın, iletişim becerileri gelişmiş, ,Güleryüzlü,motivasyonu yüksek, ,Bayan.,Hemşirelerimiz için lojman imkanı sağlanmaktadır.",Ameliyathane Hemşiresi,saglik,İstanbul(Avr.),Sağlık Kuruluşları,Türkiye Hastanesi,En az 3 yıl tecrübeli adaylar
Uzman,Sürekli / Tam zamanlı,,"Hastanemiz bünyesindeki Acil Serviste görevlendirilmek üzere Türk veya yabancı,,""Pratisyen Hekim"", istihdam edilecektir.",Pratisyen Hekim,saglik,,Sağlık,Türkiye Hastanesi,
,,,"GENEL NİTELİKLER,4 yıllık üniversite mezunu,,İlaç sektöründe (tercihen Nadir Hastalıklar alanında) 1-3 yıl tecrübeli,,Sürücü belgesine sahip ve aktif olarak araç kullanan,,MS Office uygulamalarına hakim,,ÜTE sertifikasına sahip,,Erkek adaylar için askerlik görevini tamamlamış,,İŞ TANIMI,Satış hedeflerini gerçekleştirmek üzere sağlık mesleği mensupları arasında Sanofi Genzyme’ın sorumluluğundaki Nadir Hastalıkların farkındalığını artırmak ve şirket stratejileri doğrultusunda sorumlu olduğu markaların tanıtım faaliyetlerini gerçekleştirmek.",Bilimsel Tanıtım Sorumlusu,saglik,,,Sanofi Sağlık Ürünleri Limited Şirketi,
(Belirtilmemiştir),Sürekli / Tam zamanlı,,"• Ebelik Sağlık Meslek Lisesi, Sağlık Yüksek Okulu veya Lisans mezunu, ,• En az 7 yıl deneyimi olan, ,• Alanındaki yenilikleri takip eden,,• Hasta odaklı hizmet anlayışını benimseyen, ,• Ekip çalışmasına yatkın ve yönetebilen, ,• Yönetici kabiliyetine sahip,,• Sözlü ve yazılı iletişimi güçlü, ,• Güler yüzlü, ,• Bayan.",Sorumlu Ebe,saglik,,Sağlık,Türkiye Hastanesi,En az 7 yıl tecrübeli adaylar
Sürekli / Tam zamanlı,Sağlık,"Üniversite(Mezun), Yüksek Lisans(Öğrenci), Yüksek Lisans(Mezun), Doktora(Öğrenci), Doktora(Mezun)","Genel nitelikler:,Çalışan ve hasta güvenliğini daima ön planda tutan, ulusal ve uluslararası standartlarda hemşirelik bakımı uygulayan Yeditepe Üniversitesi Hastanesi’ne; Ameliyathane Servisi’nde görevlendirilmek üzere hemşire alınacaktır.,Aranılan özellikler:,•Üniversitelerin Hemşirelik Bölümlerinden mezun,,•Mesleğinde profesyonelliği hedefleyen,,•Sektördeki gelişmeleri ve teknolojiyi takip eden,,•Ekip çalışmasına yatkın,,•Gelişime açık, güleryüzlü,,•Vardiyalı çalışabilecek,, ,Sunulan olanaklar,•Maaş ve performans priminden oluşan ücret paketi,•Hizmet içi eğitim programı,•Hemşirelere özel koçluk eğitimleri ve kişisel gelişim olanakları,,•Mesleki eğitimler ve yetkinliğe yönelik sertifika ve kurs programları,,•Kongre ve sempozyumlara katılım,,•Bilimsel araştırma desteği,,•Lojman, yemek, servis ve özel sağlık sigortası imkanları., , , ",Ameliyathane Hemşiresi,saglik,İstanbul(Asya),Sağlık,Yeditepe Üniversitesi,En az 1 yıl tecrübeli adaylar
,,,"Alternatif Tıp - Tıbbi Hacamat sertifikası olan,Tıbbi Hacamat konusunda deneyimli,Acil Servis Deneyimi olan,,Branşı ile ilgili tanı ve tedavi yaklaşımları konusunda deneyimli,,Hasta güvenliği ve memnuniyetine önem veren,,Tıbbi etik ve dürüstlük ilkelerimizi benimseyecek,,İletişimi güçlü, takım çalışmasına uyumlu,,Dinamik bir çalışma ortamının gerektirdiği temel esnekliğe sahip,,İŞ TANIMI,Etik ilkelerden asla ödün vermeden ,bilimsel ve teknolojik gelişmeleri takip eden ve hastalarımıza hak ettikleri kaliteli ve güvenilir sağlık hizmetlerini sunan Hisar Çamlıca Hastanesi bünyesinde görevlendirilmek üzere; ,Acil Servis Hekimi - Alternatif Tıp Uzmanı ( Tıbbi Hacamat Uzmanı ) arayışımız  bulunmaktadır.",Acil Servis Hekimi/Alternatif Tıp Hacamat Uzmanı,saglik,,,Hisar Hospital Çamlıca,
Sürekli / Tam zamanlı,Sağlık,,"·,      ,Üniversitelerin Uluslararası İlişkiler, Sağlık Kurumları İşletmeciliği, Halkla İlişkiler ya da İşletme bölümlerinden mezun,,       Tercihen sağlık sektöründe deneyimli,,       İngilizce dilini ileri düzeyde bilen (yazma, okuma, konuşma mükemmel seviyede) ,,       Tercihen ikinci bir dili ileri düzeyde konuşabilen,,       Dış görünüşüne önem veren, diksiyonu düzgün,,       Tempolu ve esnek çalışma saatlerine ayak uydurabilecek, ,       Pozitif insan ilişkileri kurabilen,  ,       Temsil ve ikna yeteneği güçlü, organizasyon ve iletişim becerileri gelişmiş bir "" takım arkadaşı"" arıyoruz.",Uluslararası Hasta İlişkileri Uzmanı,saglik,Ankara(Çankaya),Sağlık,Güven Sağlık Grubu,Tecrübeli ya da tecrübesiz adaylar
Sürekli / Tam zamanlı,Satış,"Türkçe( Okuma : İleri, Yazma : İleri, Konuşma : İleri)"," ,İŞ TANIMI,Ziyaret ve tanıtımdan sorumlu olduğu sağlık çalışanlarına yönelik tanıtım faaliyetlerini Doktor Grup Aktivitesi, Eczane Grup Aktivitesi, Ürün Bilgilendirme Yemeği), Nöbet Sunum, e-tanıtım, numune dağıtımı, görsel malzeme çalışmaları yürüterek, belirlenen hedefler çerçevesinde tanıtım tekniklerini hekim ve eczane ziyaretlerinde uygulamak?,Sağlık çalışanlarına, ürünlerin resmi otoritelerce onaylanmış endikasyonları kapsamında ürün tanıtımını yapmak ve ürünlerin yaygın olarak bilinirliğini sağlamak??,Eczaneleri tanıtım kampanyaları hakkında bilgilendirmek, ürünlerin eczanelerdeki tüketimlerini ve stoklarını takip etmek",Ürün Tanıtım Uzmanı (Gaziantep - Onkoloji),saglik,Gaziantep,İlaç Sanayi,AstraZeneca,Tecrübeli ya da tecrübesiz adaylar
,,,"Kliniğimizde ve anlaşmalı olduğumuz  hastanelerde  plastik cerrahi uzmanı ile birlikte çalışacak tecrübeli  hemşire aranmaktadır .,Aranan Nitelikler,Gerekli ön hazırlıkları yaparak hastayı bölüme kabul etmek.,Hastaya uygulanan işlem süresince ve operasyon sonrası  gerekli desteği vermek.,İşlem sonrasında hastayla ilgili, genel düzene ve idari işlere dair tüm gerekli işlemleri tamamlamak.,Op.Dr.Selçuk Yazan bünyesinde sunulan hemşirelik ve Vip hizmetlerinin kalitesinin geliştirilmesine katkı sağlamak,İleri derecede İngilizce bilen ,İstekli, ekip çalışmasına yatkın, aktif, güler yüzlü, bakımlı, prezentabl,esnek çalışma saatlerine uyabilen bilen, etik kurallara uyabilen ekip arkadaşları arıyoruz",Hemşire,saglik,,,SELÇUK YAZAN,
Sürekli / Tam zamanlı,Hizmet,,"Mersin lokasyonumuzda bulunan Ortak Sağlık Güvenlik Birimimizde görevlendirilmek üzere aşağıdaki niteliklere sahip “B ve C, Sınıfı, İş Sağlığı ve Güvenliği Uzmanı  ,”, arayışımız bulunmaktadır.,- Üniversitelerin İş Sağlığı ve Güvenliği veya Mühendislik bölümlerinden mezun,,- B ve C Sınıfı İş Sağlığı ve Güvenliği Uzmanı sertifikasına sahip,,- En az 1 yıl iş deneyimi bulunan,- ,Hizmet Sektöründe İş Sağlığı ve Güvenliği Uzmanı olarak kariyer hedefleyen,,- MS Office uygulamalarına hakim, raporlama yapabilecek,,- Planlama, organizasyon ve analitik düşünme yeteneği gelişmiş, ekip çalışmasına yatkın,,- Sürücü belgesi bulunan, aktif olarak araç kullanabilen,,- Seyahat engeli bulunmayan,,- Yoğun çalışma temposu ve esnek çalışma saatlerine uyum sağlayabilecek,,- Yönetmeliklere uygun olarak ,tam zamanlı, görev alabilecek,,- Erkek adaylar için askerlik hizmetini tamamlanmış,İŞ TANIMI,- Tehlikelerin tanımlanması, risk analizleri ve değerlendirmelerinin yapılarak riskleri ortadan kaldırıcı uygulamaların geliştirilmesi ve saha uygulamalarının gerçekleştirilmesi,,- İş Sağlığı ve Güvenliği kapsamındaki eğitim ihtiyaç analizinin yapılması ve eğitimlerin verilmesi,,- Acil durum planlarının hazırlanması, kaza istatistiklerinin oluşturulması,,- İş Sağlığı ve Güvenliği ve Çevre faaliyetlerinin takip edilmesi ve denetimlerle gerekli müdahalelerin yapılması,,- İş Güvenliği ve Çevre uygulamalarının standardının artırılmasına katkıda bulunulması.",B/C Sınıfı İş Güvenliği Uzmanı,saglik,,Elektronik Güvenlik Sistemleri,Gizli Firma,
Yeni Başlayan,Sürekli / Tam zamanlı,,"Üniversite mezunu,,MS Ofis uygulamalarına hakim, ,Sürücü belgesine sahip ve aktif araç kullanabilen,,Askerlik görevini yerine getirmiş (erkek adaylar için),İŞ TANIMI,İnsan ilişkilerinde uyumlu ve takım çalışmasına inanan ,Öğrenmeye istekli ve kişisel gelişmeye açık olan ,Sorumluluk almayı seven ve insiyatif kullanabilen ,Analitik düşünebilen ve planlama yapabilen ,Düzgün olarak doktor ve eczane ziyaretleri yapabilecek ,                        TAKIM ARKADAŞLARI ARIYORUZ...",TIBBİ SATIŞ MÜMESSİLİ,saglik,,Satış,Next,
(Belirtilmemiştir),Sürekli / Tam zamanlı,,"3 bin baş kapasiteli modern koyunculuk işletmesinde görevlendirilmek üzere aşağıdaki niteliklere sahip Veteriner Sağlık teknikeri arıyoruz.,Üniversitelerin tercihen Veterinerlik veya Veteriner Sağlık Teknikerliği bölümlerinden mezun,,Tercihen en az 1 yıl çiftlik  tecrübeli,,Sürücü Belgesi olan, aktif olarak araç kullanabilen,MS Office programlarına hakim,,İletişimi güçlü, ekip çalışmasına uygun, aktif çalışmayı seven, dinamik, sorumluluk alabilen, farklı görev ve sorumlulukları yerine getirebilen, ,Erkek adaylar için tercihen askerlik görevini tamamlamış.,İş Tanımı,İşletmede sağlık koruma, klinik, sürü takip işlemlerini yerine getirerek, Müdürü’ ne raporlama yapmak,,Çiftlik çalışanların görev ve sorumlulukların takibi, ihtiyaç duyulan malzeme, ürün ve hizmetleri  belirlenmesi ve sorumlu müdürüne  iletimi vb süreçleri yönetmek.",Veteriner Sağlık Teknikeri,saglik,,Hizmet,Advantage Properties International Eml.Yat Mim İns,Tecrübeli ya da tecrübesiz adaylar
Sürekli / Tam zamanlı,Sağlık,,"Türkiye'de yüksek bir ivme ile gelişen sağlık turizminde öncü firmamızın, en iyi hizmeti sunma amacına uygun olarak çalışabilecek ,* Üniversitelerin ilgili tıp bölümünden mezun,,* Tam zamanlı olarak görev yapacak,,* Uzmanlık alanı ile ilgili gelişmeleri takip eden, ,* Branşının gerektirdiği vizyona sahip,,* İnsan ilişkileri ve iletişim becerileri güçlü, güler yüzlü,,* Hasta güvenliği ve memnuniyetine önem veren,,* İyi derecede İngilizce bilen,,* Yoğun hasta akışına uyum sağlayabilecek,,* Seyahat engeli olmayan,,Branşında uzman estetik ve plastik cerrahi uzman hekim aranmaktadır. ,Not : Şartlar karşılıklı görüşülecektir. ",Plastik Cerrahi Uzmanı,saglik,,Sağlık Hizmetleri,Medkor Sağlık ve Bilişim Hizmetleri Ltd. Şti.,Tecrübeli ya da tecrübesiz adaylar
,,,"- 35 yaşını aşmamış, ,- Tercihen İlaç sektöründe deneyimli, ,- Sürücü ehliyeti olan ve araç kullanım deneyimine sahip,,- Seyahat engeli olmayan, ,- Askerliğini yapmış ( Erkek adaylar için), ,- En az ön lisans mezunu, , ",Tıbbi Mümessil,saglik,,,ATABAY İLAÇ FABRİKASI A.Ş.,
,,Üniversite(Mezun),"Kuşadası Davutlar'daki Natur-Med Termal Sağlık Oteli'mize: ,- İyi derecede Almanca bilen (konuşma, okuma, yazma), ,- Almanya'daki işlerimize de yardımcı olabilecek ve seyahat engeli bulunmayan,,- Prezantabl, insan ilişkileri güçlü,,- Natur-Med sağlık konseptiyle ilgilenen ve bu alanda kendini geliştirerek kariyerine bu alanda devam etmeyi hedefleyen, ,- Tercihen İngilizce de bilen ve yöneticilik deneyimine sahip. ,- Yeşil, doğal ve sağlıklı bir çevrede yaşama arzusu olan Medikal Doktor arıyoruz. ",Medikal Doktor,saglik,,,Natur-Med,En az 5 yıl tecrübeli adaylar
,,,BODRUM ORTAKENTTE  AÇILACAK OLAN NEFES AĞIZ VE DİŞ SAGLIĞI POLİKLİNİĞİMİZE YENİ MEZUN HEKİM TECRÜBELİ HEKİM VE ÇENE CERRAHİ ÇALIŞMA ARKADASLARI ALINACAKTIR,DİŞ HEKİMİ,saglik,,,AYİS MEDİKAL SANAYİ VE TİCARET LİMİTED ŞİRKETİ,
Sürekli / Tam zamanlı,Yönetim,,İŞ TANIMI,Eczacı,saglik,,Ecza Depoları ve Eczaneler ,Fatih Ecza Deposu,En az 1 yıl tecrübeli adaylar
,,,"Hastanemizde görevlendirilmek üzere;,Etik değerlere bağlı, hasta güvenliği ve memnuniyetine önem veren,,İletişim yeteneği kuvvetli,Tercihen Kadın,          ,Kadın Hastalıkları ve Doğum Uzmanı aramaktayız",Kadın Hastalıkları ve Doğum Uzmanı,saglik,,,HÜMA KADIN HASTALIKLARI VE DOĞUM HASTANESİ,
Uzman Yardımcısı,Sürekli / Tam zamanlı,,"Sağlıkta profesyonel yaklaşımı ve ileri teknolojisiyle sektörün çıtasını sürekli yükselten Medistate Kavacık Hastanesi ,'Ameliyathane Bölümü""nde',  görevlendirmek üzere;,Sağlık meslek liselerinin ve/veya üniversitelerin 'Anestezi Teknisyeni/Teknikeri' bölümünden mezun,,Branşıyla ilgili en az 2 yıl deneyimli, ,İletişime ve yeniliklere açık, ,Hasta ve çalışan güvenliği ilkelerini benimsemiş, ,Vardiyalı çalışma sistemine uyum sağlayabilecek, ,Erkek adaylar için askerlik hizmetini tamamlamış. ,'Anestezi Teknikeri' ,aranmaktadır., , ",Anestezi Teknikeri,saglik,,Sağlık,Medistate Kavacık Hastanesi,
Dönemsel / Proje bazlı,Sağlık,,"Çok Tecrübeli porselenci diş teknisyeni aranıyor.Günlük,parçabaşı veya aylık çalışılabilir.Ek iş gibi çalışılabilir .Ücret çok yüksektir.istanbul.",Diş teknisyeni( porselenci),saglik,İstanbul(Avr.),Diğer,Gizli Firma,8 - 25 yıl tecrübeli adaylar
(Belirtilmemiştir),Sürekli / Tam zamanlı,"Üniversite(Mezun), Yüksek Lisans(Öğrenci), Yüksek Lisans(Mezun), Doktora(Öğrenci), Doktora(Mezun)","Gaziantep Medicalpark Hastanemizde değerlendirilmek üzre;,- Üniversitelerin 4 yıllık Fizik Tedavi ve Rehabilitasyon bölümünden mezun, , -Nörolojik ve Ortopedik Rehabilitasyon alanında Tecrübeli adaylar ,- Tercihen İngilizce bilen, , - İletişim yeteneği yüksek, branşı ile ilgili gelişme ve yenilikleri takip eden, , - Ekip çalışmasına yatkın, , - Analitik, sonuç odaklı, disiplinli, sabırlı, , - Hasta memnuniyetine önem veren, , - Yoğun ve dinamik çalışma ortamına uyum sağlayabilecek, , - Erkek adaylar için askerlik görevini yerine getirmiş olan,Ekip arakadaşı aramaktayız.",Fizyoterapist,saglik,,Sağlık Hizmetleri,Sentez Sağlık Hizmetleri A.Ş.,En az 2 yıl tecrübeli adaylar
,,,"GENEL NİTELİKLER ,Elithair Transplant Ultra VIP Saç Ekim firması 2009'dan beri sektörde öncü olup  ağırlıklı olarak Avrupalı hastalara hizmet vermektedir. ,Bahçeşehir bölgesinde yerleşik olan İstinye Üniversite Liv hastanesinde faaliyet gösteriyor,Üniversitelerin Hemşirelik bölümlerinden mezun,,Sağlık meslek yüksek okul (hemşire çıkışlı),,En az 4 yıl servis/cerrahi servis deneyimi olan,,Ekip çalışmasına yatkın,,Tam zamanlı çalışabilecek,,Dinamik veya zor çalışma ortamında kariyer hedefleyen,,Hasta güvenliği ve memnuniyeti odaklı çalışan,,Etik ve sonuç odaklı çalışan,,İletişimi güçlü, insan ilişkilerinde başarılı,,Erkek adaylar için askerlik hizmetini tamamlamış,,Not:  ATT, PARAMEDİK, LABORANT,,,ANESTEZİ TEKNİKLERİ, veya BİYOLOG başvuruları değerlendirilmeyecektir.",HEMŞİRE ( SAÇ EKİMİ),saglik,,,United Medikal ve sağlık hizmetleri LTD. Şti,
,,,"Özel hastane çalışma deneyimine sahip,,Hasta memnuniyeti odaklı çalışmayı ilke edinmiş,,İletişim yeteneği güçlü, pozitif,,Branşı ile ilgili bilimsel gelişmeleri takip eden ve uygulayan,,Branşının gerektirdiği vizyona sahip,,Tam zamanlı çalışabilecek,,Antalya/ Kumluca' da ikamet eden ya da edebilecek,RADYOLOJİ UZMANI aramaktayız.",Radyoloji Uzmanı,saglik,,,ÖZEL MEDİKUM HASTANESİ,
(Belirtilmemiştir),Sürekli / Tam zamanlı,,"Üniversitelerin 4 Yıllık bölümlerinden mezun, ,Benzer bir pozisyonda en az 2 yıl deneyimi olan / ÜTE sertifikası sahibi, ,B sınıfı sürücü ehliyetine sahip ve aktif olarak araç kullanabilen, ,MS Office programlarına hakim, ,Seyahat engeli bulunmayan, ,Erkek adaylar için askerlik hizmetini tamamlamış.  ,İŞ TANIMI,Ziyaret planı doğrultusunda doktor ve eczanelere tanıtım yapmak, ,Eczanelerde reçete ve raf kontrolünü gerçekleştirmek ve siparişleri almak, ,Belirlenen tanıtım-satış hedefleri doğrultusunda (günlük/haftalık/aylık) çalışma planını oluşturmak ve uygulamak,,Sorumluluğundaki pazar faaliyetlerini takip etmek. ",Tıbbi Mümessil ,saglik,,Sağlık,NOBEL İLAÇ SAN.VE TİC.A.Ş.,Tecrübeli ya da tecrübesiz adaylar
